{
  "address": "0x92b6214D884d369ded147105265142AcD4f18152",
  "abi": [
    {
      "inputs": [
        {
          "internalType": "address",
          "name": "swapContract",
          "type": "address"
        },
        {
          "internalType": "uint256",
          "name": "optionAuctionID",
          "type": "uint256"
        }
      ],
      "name": "getAuctionSettlementPrice",
      "outputs": [
        {
          "internalType": "uint256",
          "name": "",
          "type": "uint256"
        }
      ],
      "stateMutability": "view",
      "type": "function"
    },
    {
      "inputs": [
        {
          "internalType": "address",
          "name": "oTokenAddress",
          "type": "address"
        },
        {
          "internalType": "address",
          "name": "optionsPremiumPricer",
          "type": "address"
        },
        {
          "internalType": "uint256",
          "name": "premiumDiscount",
          "type": "uint256"
        }
      ],
      "name": "getOTokenPremium",
      "outputs": [
        {
          "internalType": "uint256",
          "name": "",
          "type": "uint256"
        }
      ],
      "stateMutability": "view",
      "type": "function"
    },
    {
      "inputs": [
        {
          "internalType": "address",
          "name": "owner",
          "type": "address"
        },
        {
          "internalType": "address",
          "name": "keeper",
          "type": "address"
        },
        {
          "internalType": "address",
          "name": "feeRecipient",
          "type": "address"
        },
        {
          "internalType": "uint256",
          "name": "performanceFee",
          "type": "uint256"
        },
        {
          "internalType": "uint256",
          "name": "managementFee",
          "type": "uint256"
        },
        {
          "internalType": "string",
          "name": "tokenName",
          "type": "string"
        },
        {
          "internalType": "string",
          "name": "tokenSymbol",
          "type": "string"
        },
        {
          "components": [
            {
              "internalType": "bool",
              "name": "isPut",
              "type": "bool"
            },
            {
              "internalType": "uint8",
              "name": "decimals",
              "type": "uint8"
            },
            {
              "internalType": "address",
              "name": "asset",
              "type": "address"
            },
            {
              "internalType": "address",
              "name": "underlying",
              "type": "address"
            },
            {
              "internalType": "uint56",
              "name": "minimumSupply",
              "type": "uint56"
            },
            {
              "internalType": "uint104",
              "name": "cap",
              "type": "uint104"
            }
          ],
          "internalType": "struct Vault.VaultParams",
          "name": "_vaultParams",
          "type": "tuple"
        }
      ],
      "name": "verifyInitializerParams",
      "outputs": [],
      "stateMutability": "pure",
      "type": "function"
    }
  ],
  "transactionHash": "0x5773b4255c2f8de9593f6b3dfc49ad314d35d45bcd3b10784e34e8718debfe83",
  "receipt": {
    "to": null,
    "from": "0x422f7Bb366608723c8fe61Ac6D923023dCCBC3d7",
    "contractAddress": "0x92b6214D884d369ded147105265142AcD4f18152",
    "transactionIndex": 119,
    "gasUsed": "3426369",
    "logsBloom": "0x00000000000000000000000000000000000000000000000000000000000000000000000000000000000000000000000000000000000000000000000000000000000000000000000000000000000000000000000000000000000000000000000000000000000000000000000000000000000000000000000000000000000000000000000000000000000000000000000000000000000000000000000000000000000000000000000000000000000000000000000000000000000000000000000000000000000000000000000000000000000000000000000000000000000000000000000000000000000000000000000000000000000000000000000000000000",
    "blockHash": "0x2f6b6ea26549491f279ea2dbf2e33ca0a6a906e4a9397fd6735334f4416ff78f",
    "transactionHash": "0x5773b4255c2f8de9593f6b3dfc49ad314d35d45bcd3b10784e34e8718debfe83",
    "logs": [],
    "blockNumber": 14797556,
    "cumulativeGasUsed": "11537851",
    "status": 1,
    "byzantium": true
  },
  "args": [],
  "solcInputHash": "90a6f9a6611a4abf21a349c7de561b69",
  "metadata": "{\"compiler\":{\"version\":\"0.8.4+commit.c7e474f2\"},\"language\":\"Solidity\",\"output\":{\"abi\":[{\"inputs\":[{\"internalType\":\"address\",\"name\":\"swapContract\",\"type\":\"address\"},{\"internalType\":\"uint256\",\"name\":\"optionAuctionID\",\"type\":\"uint256\"}],\"name\":\"getAuctionSettlementPrice\",\"outputs\":[{\"internalType\":\"uint256\",\"name\":\"\",\"type\":\"uint256\"}],\"stateMutability\":\"view\",\"type\":\"function\"},{\"inputs\":[{\"internalType\":\"address\",\"name\":\"oTokenAddress\",\"type\":\"address\"},{\"internalType\":\"address\",\"name\":\"optionsPremiumPricer\",\"type\":\"address\"},{\"internalType\":\"uint256\",\"name\":\"premiumDiscount\",\"type\":\"uint256\"}],\"name\":\"getOTokenPremium\",\"outputs\":[{\"internalType\":\"uint256\",\"name\":\"\",\"type\":\"uint256\"}],\"stateMutability\":\"view\",\"type\":\"function\"},{\"inputs\":[{\"internalType\":\"address\",\"name\":\"owner\",\"type\":\"address\"},{\"internalType\":\"address\",\"name\":\"keeper\",\"type\":\"address\"},{\"internalType\":\"address\",\"name\":\"feeRecipient\",\"type\":\"address\"},{\"internalType\":\"uint256\",\"name\":\"performanceFee\",\"type\":\"uint256\"},{\"internalType\":\"uint256\",\"name\":\"managementFee\",\"type\":\"uint256\"},{\"internalType\":\"string\",\"name\":\"tokenName\",\"type\":\"string\"},{\"internalType\":\"string\",\"name\":\"tokenSymbol\",\"type\":\"string\"},{\"components\":[{\"internalType\":\"bool\",\"name\":\"isPut\",\"type\":\"bool\"},{\"internalType\":\"uint8\",\"name\":\"decimals\",\"type\":\"uint8\"},{\"internalType\":\"address\",\"name\":\"asset\",\"type\":\"address\"},{\"internalType\":\"address\",\"name\":\"underlying\",\"type\":\"address\"},{\"internalType\":\"uint56\",\"name\":\"minimumSupply\",\"type\":\"uint56\"},{\"internalType\":\"uint104\",\"name\":\"cap\",\"type\":\"uint104\"}],\"internalType\":\"struct Vault.VaultParams\",\"name\":\"_vaultParams\",\"type\":\"tuple\"}],\"name\":\"verifyInitializerParams\",\"outputs\":[],\"stateMutability\":\"pure\",\"type\":\"function\"}],\"devdoc\":{\"kind\":\"dev\",\"methods\":{\"allocateOptions(address,address,uint256,uint256)\":{\"details\":\"Skipped if the optionsPurchaseQueue doesn't exist\",\"params\":{\"option\":\"is the minted option\",\"optionAllocation\":\"is the maximum % of options to allocate towards the purchase queue (will only allocate  up to the amount that is on the queue)\",\"optionsAmount\":\"is the amount of options minted\",\"optionsPurchaseQueue\":\"is the OptionsPurchaseQueue contract\"},\"returns\":{\"allocatedOptions\":\"is the amount of options that ended up getting allocated to the OptionsPurchaseQueue\"}},\"burnOtokens(address,address)\":{\"params\":{\"currentOption\":\"is the address of the current option\",\"gammaController\":\"is the address of the opyn controller contract\"},\"returns\":{\"_0\":\"amount of collateral redeemed by burning otokens\"}},\"closeRound(Vault.VaultState storage,VaultLifecycleWithSwap.CloseParams)\":{\"params\":{\"params\":\"is the rollover parameters passed to compute the next state\",\"vaultState\":\"is the storage variable vaultState passed from RibbonVault\"},\"returns\":{\"mintShares\":\"is the amount of shares to mint from deposits\",\"newLockedAmount\":\"is the amount of funds to allocate for the new round\",\"newPricePerShare\":\"is the price per share of the new round\",\"performanceFeeInAsset\":\"is the performance fee charged by vault\",\"queuedWithdrawAmount\":\"is the amount of funds set aside for withdrawal\",\"totalVaultFee\":\"is the total amount of fee charged by vault\"}},\"commitNextOption(VaultLifecycleWithSwap.CommitParams,Vault.VaultParams storage,Vault.VaultState storage)\":{\"params\":{\"commitParams\":\"is the struct with details on previous option and strike selection details\",\"vaultParams\":\"is the struct with vault general data\",\"vaultState\":\"is the struct with vault accounting state\"},\"returns\":{\"delta\":\"is the delta of the new option\",\"otokenAddress\":\"is the address of the new option\",\"premium\":\"is the premium of the new option\",\"strikePrice\":\"is the strike price of the new option\"}},\"createOffer(address,uint256,address,Vault.VaultParams storage)\":{\"params\":{\"currOtokenPremium\":\"is premium for each otoken\",\"currentOtoken\":\"is the current otoken address\",\"swapContract\":\"the address of the swap contract\",\"vaultParams\":\"is the struct with vault general data\"},\"returns\":{\"optionAuctionID\":\"auction id of the newly created offer\"}},\"createShort(address,address,address,uint256)\":{\"params\":{\"depositAmount\":\"is the amount of collateral to deposit\",\"gammaController\":\"is the address of the opyn controller contract\",\"marginPool\":\"is the address of the opyn margin contract which holds the collateral\",\"oTokenAddress\":\"is the address of the otoken to mint\"},\"returns\":{\"_0\":\"the otoken mint amount\"}},\"getAuctionSettlementPrice(address,uint256)\":{\"params\":{\"optionAuctionID\":\"is the offer ID\",\"swapContract\":\"The address of the swap settlement contract\"},\"returns\":{\"_0\":\"settlementPrice Auction settlement price\"}},\"sellOptionsToQueue(address,address,uint256)\":{\"details\":\"Reverts if the auction hasn't settled yet\",\"params\":{\"optionsPurchaseQueue\":\"is the OptionsPurchaseQueue contract\",\"swapContract\":\"The address of the swap settlement contract\"},\"returns\":{\"_0\":\"totalPremiums Total premiums earnt by the vault\"}},\"settleLong(address,address,address)\":{\"params\":{\"asset\":\"is the address of the vault's asset\",\"gammaController\":\"is the address of the opyn controller contract\",\"oldOption\":\"is the address of the old option\"},\"returns\":{\"_0\":\"amount of asset received by exercising the option\"}},\"settleShort(address)\":{\"params\":{\"gammaController\":\"is the address of the opyn controller contract\"},\"returns\":{\"_0\":\"amount of collateral redeemed from the vault\"}},\"verifyInitializerParams(address,address,address,uint256,uint256,string,string,Vault.VaultParams)\":{\"params\":{\"_vaultParams\":\"is the struct with vault general data\",\"feeRecipient\":\"is the address to recieve vault performance and management fees\",\"owner\":\"is the owner of the vault with critical permissions\",\"performanceFee\":\"is the perfomance fee pct.\",\"tokenName\":\"is the name of the token\",\"tokenSymbol\":\"is the symbol of the token\"}}},\"version\":1},\"userdoc\":{\"kind\":\"user\",\"methods\":{\"allocateOptions(address,address,uint256,uint256)\":{\"notice\":\"Allocates the vault's minted options to the OptionsPurchaseQueue contract\"},\"burnOtokens(address,address)\":{\"notice\":\"Burn the remaining oTokens left over from auction. Currently this implementation is simple. It burns oTokens from the most recent vault opened by the contract. This assumes that the contract will only have a single vault open at any given time.\"},\"closeRound(Vault.VaultState storage,VaultLifecycleWithSwap.CloseParams)\":{\"notice\":\"Calculate the shares to mint, new price per share, and amount of funds to re-allocate as collateral for the new round\"},\"commitNextOption(VaultLifecycleWithSwap.CommitParams,Vault.VaultParams storage,Vault.VaultState storage)\":{\"notice\":\"Sets the next option the vault will be shorting, and calculates its premium for the auction\"},\"createOffer(address,uint256,address,Vault.VaultParams storage)\":{\"notice\":\"Creates an offer in the Swap Contract\"},\"createShort(address,address,address,uint256)\":{\"notice\":\"Creates the actual Opyn short position by depositing collateral and minting otokens\"},\"getAuctionSettlementPrice(address,uint256)\":{\"notice\":\"Gets the settlement price of a settled auction\"},\"sellOptionsToQueue(address,address,uint256)\":{\"notice\":\"Sell the allocated options to the purchase queue post auction settlement\"},\"settleLong(address,address,address)\":{\"notice\":\"Exercises the ITM option using existing long otoken position. Currently this implementation is simple. It calls the `Redeem` action to claim the payout.\"},\"settleShort(address)\":{\"notice\":\"Close the existing short otoken position. Currently this implementation is simple. It closes the most recent vault opened by the contract. This assumes that the contract will only have a single vault open at any given time. Since calling `_closeShort` deletes vaults by calling SettleVault action, this assumption should hold.\"},\"verifyInitializerParams(address,address,address,uint256,uint256,string,string,Vault.VaultParams)\":{\"notice\":\"Verify the constructor params satisfy requirements\"}},\"version\":1}},\"settings\":{\"compilationTarget\":{\"contracts/libraries/VaultLifecycleWithSwap.sol\":\"VaultLifecycleWithSwap\"},\"evmVersion\":\"istanbul\",\"libraries\":{},\"metadata\":{\"bytecodeHash\":\"ipfs\",\"useLiteralContent\":true},\"optimizer\":{\"enabled\":true,\"runs\":200},\"remappings\":[]},\"sources\":{\"@openzeppelin/contracts/token/ERC20/IERC20.sol\":{\"content\":\"// SPDX-License-Identifier: MIT\\n\\npragma solidity ^0.8.0;\\n\\n/**\\n * @dev Interface of the ERC20 standard as defined in the EIP.\\n */\\ninterface IERC20 {\\n    /**\\n     * @dev Returns the amount of tokens in existence.\\n     */\\n    function totalSupply() external view returns (uint256);\\n\\n    /**\\n     * @dev Returns the amount of tokens owned by `account`.\\n     */\\n    function balanceOf(address account) external view returns (uint256);\\n\\n    /**\\n     * @dev Moves `amount` tokens from the caller's account to `recipient`.\\n     *\\n     * Returns a boolean value indicating whether the operation succeeded.\\n     *\\n     * Emits a {Transfer} event.\\n     */\\n    function transfer(address recipient, uint256 amount) external returns (bool);\\n\\n    /**\\n     * @dev Returns the remaining number of tokens that `spender` will be\\n     * allowed to spend on behalf of `owner` through {transferFrom}. This is\\n     * zero by default.\\n     *\\n     * This value changes when {approve} or {transferFrom} are called.\\n     */\\n    function allowance(address owner, address spender) external view returns (uint256);\\n\\n    /**\\n     * @dev Sets `amount` as the allowance of `spender` over the caller's tokens.\\n     *\\n     * Returns a boolean value indicating whether the operation succeeded.\\n     *\\n     * IMPORTANT: Beware that changing an allowance with this method brings the risk\\n     * that someone may use both the old and the new allowance by unfortunate\\n     * transaction ordering. One possible solution to mitigate this race\\n     * condition is to first reduce the spender's allowance to 0 and set the\\n     * desired value afterwards:\\n     * https://github.com/ethereum/EIPs/issues/20#issuecomment-263524729\\n     *\\n     * Emits an {Approval} event.\\n     */\\n    function approve(address spender, uint256 amount) external returns (bool);\\n\\n    /**\\n     * @dev Moves `amount` tokens from `sender` to `recipient` using the\\n     * allowance mechanism. `amount` is then deducted from the caller's\\n     * allowance.\\n     *\\n     * Returns a boolean value indicating whether the operation succeeded.\\n     *\\n     * Emits a {Transfer} event.\\n     */\\n    function transferFrom(\\n        address sender,\\n        address recipient,\\n        uint256 amount\\n    ) external returns (bool);\\n\\n    /**\\n     * @dev Emitted when `value` tokens are moved from one account (`from`) to\\n     * another (`to`).\\n     *\\n     * Note that `value` may be zero.\\n     */\\n    event Transfer(address indexed from, address indexed to, uint256 value);\\n\\n    /**\\n     * @dev Emitted when the allowance of a `spender` for an `owner` is set by\\n     * a call to {approve}. `value` is the new allowance.\\n     */\\n    event Approval(address indexed owner, address indexed spender, uint256 value);\\n}\\n\",\"keccak256\":\"0x027b891937d20ccf213fdb9c31531574256de774bda99d3a70ecef6e1913ed2a\",\"license\":\"MIT\"},\"@openzeppelin/contracts/token/ERC20/utils/SafeERC20.sol\":{\"content\":\"// SPDX-License-Identifier: MIT\\n\\npragma solidity ^0.8.0;\\n\\nimport \\\"../IERC20.sol\\\";\\nimport \\\"../../../utils/Address.sol\\\";\\n\\n/**\\n * @title SafeERC20\\n * @dev Wrappers around ERC20 operations that throw on failure (when the token\\n * contract returns false). Tokens that return no value (and instead revert or\\n * throw on failure) are also supported, non-reverting calls are assumed to be\\n * successful.\\n * To use this library you can add a `using SafeERC20 for IERC20;` statement to your contract,\\n * which allows you to call the safe operations as `token.safeTransfer(...)`, etc.\\n */\\nlibrary SafeERC20 {\\n    using Address for address;\\n\\n    function safeTransfer(\\n        IERC20 token,\\n        address to,\\n        uint256 value\\n    ) internal {\\n        _callOptionalReturn(token, abi.encodeWithSelector(token.transfer.selector, to, value));\\n    }\\n\\n    function safeTransferFrom(\\n        IERC20 token,\\n        address from,\\n        address to,\\n        uint256 value\\n    ) internal {\\n        _callOptionalReturn(token, abi.encodeWithSelector(token.transferFrom.selector, from, to, value));\\n    }\\n\\n    /**\\n     * @dev Deprecated. This function has issues similar to the ones found in\\n     * {IERC20-approve}, and its usage is discouraged.\\n     *\\n     * Whenever possible, use {safeIncreaseAllowance} and\\n     * {safeDecreaseAllowance} instead.\\n     */\\n    function safeApprove(\\n        IERC20 token,\\n        address spender,\\n        uint256 value\\n    ) internal {\\n        // safeApprove should only be called when setting an initial allowance,\\n        // or when resetting it to zero. To increase and decrease it, use\\n        // 'safeIncreaseAllowance' and 'safeDecreaseAllowance'\\n        require(\\n            (value == 0) || (token.allowance(address(this), spender) == 0),\\n            \\\"SafeERC20: approve from non-zero to non-zero allowance\\\"\\n        );\\n        _callOptionalReturn(token, abi.encodeWithSelector(token.approve.selector, spender, value));\\n    }\\n\\n    function safeIncreaseAllowance(\\n        IERC20 token,\\n        address spender,\\n        uint256 value\\n    ) internal {\\n        uint256 newAllowance = token.allowance(address(this), spender) + value;\\n        _callOptionalReturn(token, abi.encodeWithSelector(token.approve.selector, spender, newAllowance));\\n    }\\n\\n    function safeDecreaseAllowance(\\n        IERC20 token,\\n        address spender,\\n        uint256 value\\n    ) internal {\\n        unchecked {\\n            uint256 oldAllowance = token.allowance(address(this), spender);\\n            require(oldAllowance >= value, \\\"SafeERC20: decreased allowance below zero\\\");\\n            uint256 newAllowance = oldAllowance - value;\\n            _callOptionalReturn(token, abi.encodeWithSelector(token.approve.selector, spender, newAllowance));\\n        }\\n    }\\n\\n    /**\\n     * @dev Imitates a Solidity high-level call (i.e. a regular function call to a contract), relaxing the requirement\\n     * on the return value: the return value is optional (but if data is returned, it must not be false).\\n     * @param token The token targeted by the call.\\n     * @param data The call data (encoded using abi.encode or one of its variants).\\n     */\\n    function _callOptionalReturn(IERC20 token, bytes memory data) private {\\n        // We need to perform a low level call here, to bypass Solidity's return data size checking mechanism, since\\n        // we're implementing it ourselves. We use {Address.functionCall} to perform this call, which verifies that\\n        // the target address contains contract code and also asserts for success in the low-level call.\\n\\n        bytes memory returndata = address(token).functionCall(data, \\\"SafeERC20: low-level call failed\\\");\\n        if (returndata.length > 0) {\\n            // Return data is optional\\n            require(abi.decode(returndata, (bool)), \\\"SafeERC20: ERC20 operation did not succeed\\\");\\n        }\\n    }\\n}\\n\",\"keccak256\":\"0x02348b2e4b9f3200c7e3907c5c2661643a6d8520e9f79939fbb9b4005a54894d\",\"license\":\"MIT\"},\"@openzeppelin/contracts/utils/Address.sol\":{\"content\":\"// SPDX-License-Identifier: MIT\\n\\npragma solidity ^0.8.0;\\n\\n/**\\n * @dev Collection of functions related to the address type\\n */\\nlibrary Address {\\n    /**\\n     * @dev Returns true if `account` is a contract.\\n     *\\n     * [IMPORTANT]\\n     * ====\\n     * It is unsafe to assume that an address for which this function returns\\n     * false is an externally-owned account (EOA) and not a contract.\\n     *\\n     * Among others, `isContract` will return false for the following\\n     * types of addresses:\\n     *\\n     *  - an externally-owned account\\n     *  - a contract in construction\\n     *  - an address where a contract will be created\\n     *  - an address where a contract lived, but was destroyed\\n     * ====\\n     */\\n    function isContract(address account) internal view returns (bool) {\\n        // This method relies on extcodesize, which returns 0 for contracts in\\n        // construction, since the code is only stored at the end of the\\n        // constructor execution.\\n\\n        uint256 size;\\n        assembly {\\n            size := extcodesize(account)\\n        }\\n        return size > 0;\\n    }\\n\\n    /**\\n     * @dev Replacement for Solidity's `transfer`: sends `amount` wei to\\n     * `recipient`, forwarding all available gas and reverting on errors.\\n     *\\n     * https://eips.ethereum.org/EIPS/eip-1884[EIP1884] increases the gas cost\\n     * of certain opcodes, possibly making contracts go over the 2300 gas limit\\n     * imposed by `transfer`, making them unable to receive funds via\\n     * `transfer`. {sendValue} removes this limitation.\\n     *\\n     * https://diligence.consensys.net/posts/2019/09/stop-using-soliditys-transfer-now/[Learn more].\\n     *\\n     * IMPORTANT: because control is transferred to `recipient`, care must be\\n     * taken to not create reentrancy vulnerabilities. Consider using\\n     * {ReentrancyGuard} or the\\n     * https://solidity.readthedocs.io/en/v0.5.11/security-considerations.html#use-the-checks-effects-interactions-pattern[checks-effects-interactions pattern].\\n     */\\n    function sendValue(address payable recipient, uint256 amount) internal {\\n        require(address(this).balance >= amount, \\\"Address: insufficient balance\\\");\\n\\n        (bool success, ) = recipient.call{value: amount}(\\\"\\\");\\n        require(success, \\\"Address: unable to send value, recipient may have reverted\\\");\\n    }\\n\\n    /**\\n     * @dev Performs a Solidity function call using a low level `call`. A\\n     * plain `call` is an unsafe replacement for a function call: use this\\n     * function instead.\\n     *\\n     * If `target` reverts with a revert reason, it is bubbled up by this\\n     * function (like regular Solidity function calls).\\n     *\\n     * Returns the raw returned data. To convert to the expected return value,\\n     * use https://solidity.readthedocs.io/en/latest/units-and-global-variables.html?highlight=abi.decode#abi-encoding-and-decoding-functions[`abi.decode`].\\n     *\\n     * Requirements:\\n     *\\n     * - `target` must be a contract.\\n     * - calling `target` with `data` must not revert.\\n     *\\n     * _Available since v3.1._\\n     */\\n    function functionCall(address target, bytes memory data) internal returns (bytes memory) {\\n        return functionCall(target, data, \\\"Address: low-level call failed\\\");\\n    }\\n\\n    /**\\n     * @dev Same as {xref-Address-functionCall-address-bytes-}[`functionCall`], but with\\n     * `errorMessage` as a fallback revert reason when `target` reverts.\\n     *\\n     * _Available since v3.1._\\n     */\\n    function functionCall(\\n        address target,\\n        bytes memory data,\\n        string memory errorMessage\\n    ) internal returns (bytes memory) {\\n        return functionCallWithValue(target, data, 0, errorMessage);\\n    }\\n\\n    /**\\n     * @dev Same as {xref-Address-functionCall-address-bytes-}[`functionCall`],\\n     * but also transferring `value` wei to `target`.\\n     *\\n     * Requirements:\\n     *\\n     * - the calling contract must have an ETH balance of at least `value`.\\n     * - the called Solidity function must be `payable`.\\n     *\\n     * _Available since v3.1._\\n     */\\n    function functionCallWithValue(\\n        address target,\\n        bytes memory data,\\n        uint256 value\\n    ) internal returns (bytes memory) {\\n        return functionCallWithValue(target, data, value, \\\"Address: low-level call with value failed\\\");\\n    }\\n\\n    /**\\n     * @dev Same as {xref-Address-functionCallWithValue-address-bytes-uint256-}[`functionCallWithValue`], but\\n     * with `errorMessage` as a fallback revert reason when `target` reverts.\\n     *\\n     * _Available since v3.1._\\n     */\\n    function functionCallWithValue(\\n        address target,\\n        bytes memory data,\\n        uint256 value,\\n        string memory errorMessage\\n    ) internal returns (bytes memory) {\\n        require(address(this).balance >= value, \\\"Address: insufficient balance for call\\\");\\n        require(isContract(target), \\\"Address: call to non-contract\\\");\\n\\n        (bool success, bytes memory returndata) = target.call{value: value}(data);\\n        return verifyCallResult(success, returndata, errorMessage);\\n    }\\n\\n    /**\\n     * @dev Same as {xref-Address-functionCall-address-bytes-}[`functionCall`],\\n     * but performing a static call.\\n     *\\n     * _Available since v3.3._\\n     */\\n    function functionStaticCall(address target, bytes memory data) internal view returns (bytes memory) {\\n        return functionStaticCall(target, data, \\\"Address: low-level static call failed\\\");\\n    }\\n\\n    /**\\n     * @dev Same as {xref-Address-functionCall-address-bytes-string-}[`functionCall`],\\n     * but performing a static call.\\n     *\\n     * _Available since v3.3._\\n     */\\n    function functionStaticCall(\\n        address target,\\n        bytes memory data,\\n        string memory errorMessage\\n    ) internal view returns (bytes memory) {\\n        require(isContract(target), \\\"Address: static call to non-contract\\\");\\n\\n        (bool success, bytes memory returndata) = target.staticcall(data);\\n        return verifyCallResult(success, returndata, errorMessage);\\n    }\\n\\n    /**\\n     * @dev Same as {xref-Address-functionCall-address-bytes-}[`functionCall`],\\n     * but performing a delegate call.\\n     *\\n     * _Available since v3.4._\\n     */\\n    function functionDelegateCall(address target, bytes memory data) internal returns (bytes memory) {\\n        return functionDelegateCall(target, data, \\\"Address: low-level delegate call failed\\\");\\n    }\\n\\n    /**\\n     * @dev Same as {xref-Address-functionCall-address-bytes-string-}[`functionCall`],\\n     * but performing a delegate call.\\n     *\\n     * _Available since v3.4._\\n     */\\n    function functionDelegateCall(\\n        address target,\\n        bytes memory data,\\n        string memory errorMessage\\n    ) internal returns (bytes memory) {\\n        require(isContract(target), \\\"Address: delegate call to non-contract\\\");\\n\\n        (bool success, bytes memory returndata) = target.delegatecall(data);\\n        return verifyCallResult(success, returndata, errorMessage);\\n    }\\n\\n    /**\\n     * @dev Tool to verifies that a low level call was successful, and revert if it wasn't, either by bubbling the\\n     * revert reason using the provided one.\\n     *\\n     * _Available since v4.3._\\n     */\\n    function verifyCallResult(\\n        bool success,\\n        bytes memory returndata,\\n        string memory errorMessage\\n    ) internal pure returns (bytes memory) {\\n        if (success) {\\n            return returndata;\\n        } else {\\n            // Look for revert reason and bubble it up if present\\n            if (returndata.length > 0) {\\n                // The easiest way to bubble the revert reason is using memory via assembly\\n\\n                assembly {\\n                    let returndata_size := mload(returndata)\\n                    revert(add(32, returndata), returndata_size)\\n                }\\n            } else {\\n                revert(errorMessage);\\n            }\\n        }\\n    }\\n}\\n\",\"keccak256\":\"0x3336baae5cf23e94274d75336e2d412193be508504aee185e61dc7d58cd05c8a\",\"license\":\"MIT\"},\"@openzeppelin/contracts/utils/math/SafeMath.sol\":{\"content\":\"// SPDX-License-Identifier: MIT\\n\\npragma solidity ^0.8.0;\\n\\n// CAUTION\\n// This version of SafeMath should only be used with Solidity 0.8 or later,\\n// because it relies on the compiler's built in overflow checks.\\n\\n/**\\n * @dev Wrappers over Solidity's arithmetic operations.\\n *\\n * NOTE: `SafeMath` is no longer needed starting with Solidity 0.8. The compiler\\n * now has built in overflow checking.\\n */\\nlibrary SafeMath {\\n    /**\\n     * @dev Returns the addition of two unsigned integers, with an overflow flag.\\n     *\\n     * _Available since v3.4._\\n     */\\n    function tryAdd(uint256 a, uint256 b) internal pure returns (bool, uint256) {\\n        unchecked {\\n            uint256 c = a + b;\\n            if (c < a) return (false, 0);\\n            return (true, c);\\n        }\\n    }\\n\\n    /**\\n     * @dev Returns the substraction of two unsigned integers, with an overflow flag.\\n     *\\n     * _Available since v3.4._\\n     */\\n    function trySub(uint256 a, uint256 b) internal pure returns (bool, uint256) {\\n        unchecked {\\n            if (b > a) return (false, 0);\\n            return (true, a - b);\\n        }\\n    }\\n\\n    /**\\n     * @dev Returns the multiplication of two unsigned integers, with an overflow flag.\\n     *\\n     * _Available since v3.4._\\n     */\\n    function tryMul(uint256 a, uint256 b) internal pure returns (bool, uint256) {\\n        unchecked {\\n            // Gas optimization: this is cheaper than requiring 'a' not being zero, but the\\n            // benefit is lost if 'b' is also tested.\\n            // See: https://github.com/OpenZeppelin/openzeppelin-contracts/pull/522\\n            if (a == 0) return (true, 0);\\n            uint256 c = a * b;\\n            if (c / a != b) return (false, 0);\\n            return (true, c);\\n        }\\n    }\\n\\n    /**\\n     * @dev Returns the division of two unsigned integers, with a division by zero flag.\\n     *\\n     * _Available since v3.4._\\n     */\\n    function tryDiv(uint256 a, uint256 b) internal pure returns (bool, uint256) {\\n        unchecked {\\n            if (b == 0) return (false, 0);\\n            return (true, a / b);\\n        }\\n    }\\n\\n    /**\\n     * @dev Returns the remainder of dividing two unsigned integers, with a division by zero flag.\\n     *\\n     * _Available since v3.4._\\n     */\\n    function tryMod(uint256 a, uint256 b) internal pure returns (bool, uint256) {\\n        unchecked {\\n            if (b == 0) return (false, 0);\\n            return (true, a % b);\\n        }\\n    }\\n\\n    /**\\n     * @dev Returns the addition of two unsigned integers, reverting on\\n     * overflow.\\n     *\\n     * Counterpart to Solidity's `+` operator.\\n     *\\n     * Requirements:\\n     *\\n     * - Addition cannot overflow.\\n     */\\n    function add(uint256 a, uint256 b) internal pure returns (uint256) {\\n        return a + b;\\n    }\\n\\n    /**\\n     * @dev Returns the subtraction of two unsigned integers, reverting on\\n     * overflow (when the result is negative).\\n     *\\n     * Counterpart to Solidity's `-` operator.\\n     *\\n     * Requirements:\\n     *\\n     * - Subtraction cannot overflow.\\n     */\\n    function sub(uint256 a, uint256 b) internal pure returns (uint256) {\\n        return a - b;\\n    }\\n\\n    /**\\n     * @dev Returns the multiplication of two unsigned integers, reverting on\\n     * overflow.\\n     *\\n     * Counterpart to Solidity's `*` operator.\\n     *\\n     * Requirements:\\n     *\\n     * - Multiplication cannot overflow.\\n     */\\n    function mul(uint256 a, uint256 b) internal pure returns (uint256) {\\n        return a * b;\\n    }\\n\\n    /**\\n     * @dev Returns the integer division of two unsigned integers, reverting on\\n     * division by zero. The result is rounded towards zero.\\n     *\\n     * Counterpart to Solidity's `/` operator.\\n     *\\n     * Requirements:\\n     *\\n     * - The divisor cannot be zero.\\n     */\\n    function div(uint256 a, uint256 b) internal pure returns (uint256) {\\n        return a / b;\\n    }\\n\\n    /**\\n     * @dev Returns the remainder of dividing two unsigned integers. (unsigned integer modulo),\\n     * reverting when dividing by zero.\\n     *\\n     * Counterpart to Solidity's `%` operator. This function uses a `revert`\\n     * opcode (which leaves remaining gas untouched) while Solidity uses an\\n     * invalid opcode to revert (consuming all remaining gas).\\n     *\\n     * Requirements:\\n     *\\n     * - The divisor cannot be zero.\\n     */\\n    function mod(uint256 a, uint256 b) internal pure returns (uint256) {\\n        return a % b;\\n    }\\n\\n    /**\\n     * @dev Returns the subtraction of two unsigned integers, reverting with custom message on\\n     * overflow (when the result is negative).\\n     *\\n     * CAUTION: This function is deprecated because it requires allocating memory for the error\\n     * message unnecessarily. For custom revert reasons use {trySub}.\\n     *\\n     * Counterpart to Solidity's `-` operator.\\n     *\\n     * Requirements:\\n     *\\n     * - Subtraction cannot overflow.\\n     */\\n    function sub(\\n        uint256 a,\\n        uint256 b,\\n        string memory errorMessage\\n    ) internal pure returns (uint256) {\\n        unchecked {\\n            require(b <= a, errorMessage);\\n            return a - b;\\n        }\\n    }\\n\\n    /**\\n     * @dev Returns the integer division of two unsigned integers, reverting with custom message on\\n     * division by zero. The result is rounded towards zero.\\n     *\\n     * Counterpart to Solidity's `/` operator. Note: this function uses a\\n     * `revert` opcode (which leaves remaining gas untouched) while Solidity\\n     * uses an invalid opcode to revert (consuming all remaining gas).\\n     *\\n     * Requirements:\\n     *\\n     * - The divisor cannot be zero.\\n     */\\n    function div(\\n        uint256 a,\\n        uint256 b,\\n        string memory errorMessage\\n    ) internal pure returns (uint256) {\\n        unchecked {\\n            require(b > 0, errorMessage);\\n            return a / b;\\n        }\\n    }\\n\\n    /**\\n     * @dev Returns the remainder of dividing two unsigned integers. (unsigned integer modulo),\\n     * reverting with custom message when dividing by zero.\\n     *\\n     * CAUTION: This function is deprecated because it requires allocating memory for the error\\n     * message unnecessarily. For custom revert reasons use {tryMod}.\\n     *\\n     * Counterpart to Solidity's `%` operator. This function uses a `revert`\\n     * opcode (which leaves remaining gas untouched) while Solidity uses an\\n     * invalid opcode to revert (consuming all remaining gas).\\n     *\\n     * Requirements:\\n     *\\n     * - The divisor cannot be zero.\\n     */\\n    function mod(\\n        uint256 a,\\n        uint256 b,\\n        string memory errorMessage\\n    ) internal pure returns (uint256) {\\n        unchecked {\\n            require(b > 0, errorMessage);\\n            return a % b;\\n        }\\n    }\\n}\\n\",\"keccak256\":\"0x8666f020bd8fc9dc14f07e2ebc52b5f236ab4cdde7c77679b08cb2f94730043b\",\"license\":\"MIT\"},\"contracts/interfaces/GammaInterface.sol\":{\"content\":\"// SPDX-License-Identifier: MIT\\npragma solidity =0.8.4;\\n\\nlibrary GammaTypes {\\n    // vault is a struct of 6 arrays that describe a position a user has, a user can have multiple vaults.\\n    struct Vault {\\n        // addresses of oTokens a user has shorted (i.e. written) against this vault\\n        address[] shortOtokens;\\n        // addresses of oTokens a user has bought and deposited in this vault\\n        // user can be long oTokens without opening a vault (e.g. by buying on a DEX)\\n        // generally, long oTokens will be 'deposited' in vaults to act as collateral\\n        // in order to write oTokens against (i.e. in spreads)\\n        address[] longOtokens;\\n        // addresses of other ERC-20s a user has deposited as collateral in this vault\\n        address[] collateralAssets;\\n        // quantity of oTokens minted/written for each oToken address in shortOtokens\\n        uint256[] shortAmounts;\\n        // quantity of oTokens owned and held in the vault for each oToken address in longOtokens\\n        uint256[] longAmounts;\\n        // quantity of ERC-20 deposited as collateral in the vault for each ERC-20 address in collateralAssets\\n        uint256[] collateralAmounts;\\n    }\\n}\\n\\ninterface IOtoken {\\n    function underlyingAsset() external view returns (address);\\n\\n    function strikeAsset() external view returns (address);\\n\\n    function collateralAsset() external view returns (address);\\n\\n    function strikePrice() external view returns (uint256);\\n\\n    function expiryTimestamp() external view returns (uint256);\\n\\n    function isPut() external view returns (bool);\\n}\\n\\ninterface IOtokenFactory {\\n    function getOtoken(\\n        address _underlyingAsset,\\n        address _strikeAsset,\\n        address _collateralAsset,\\n        uint256 _strikePrice,\\n        uint256 _expiry,\\n        bool _isPut\\n    ) external view returns (address);\\n\\n    function createOtoken(\\n        address _underlyingAsset,\\n        address _strikeAsset,\\n        address _collateralAsset,\\n        uint256 _strikePrice,\\n        uint256 _expiry,\\n        bool _isPut\\n    ) external returns (address);\\n\\n    function getTargetOtokenAddress(\\n        address _underlyingAsset,\\n        address _strikeAsset,\\n        address _collateralAsset,\\n        uint256 _strikePrice,\\n        uint256 _expiry,\\n        bool _isPut\\n    ) external view returns (address);\\n\\n    event OtokenCreated(\\n        address tokenAddress,\\n        address creator,\\n        address indexed underlying,\\n        address indexed strike,\\n        address indexed collateral,\\n        uint256 strikePrice,\\n        uint256 expiry,\\n        bool isPut\\n    );\\n}\\n\\ninterface IController {\\n    // possible actions that can be performed\\n    enum ActionType {\\n        OpenVault,\\n        MintShortOption,\\n        BurnShortOption,\\n        DepositLongOption,\\n        WithdrawLongOption,\\n        DepositCollateral,\\n        WithdrawCollateral,\\n        SettleVault,\\n        Redeem,\\n        Call,\\n        Liquidate\\n    }\\n\\n    struct ActionArgs {\\n        // type of action that is being performed on the system\\n        ActionType actionType;\\n        // address of the account owner\\n        address owner;\\n        // address which we move assets from or to (depending on the action type)\\n        address secondAddress;\\n        // asset that is to be transfered\\n        address asset;\\n        // index of the vault that is to be modified (if any)\\n        uint256 vaultId;\\n        // amount of asset that is to be transfered\\n        uint256 amount;\\n        // each vault can hold multiple short / long / collateral assets\\n        // but we are restricting the scope to only 1 of each in this version\\n        // in future versions this would be the index of the short / long / collateral asset that needs to be modified\\n        uint256 index;\\n        // any other data that needs to be passed in for arbitrary function calls\\n        bytes data;\\n    }\\n\\n    struct RedeemArgs {\\n        // address to which we pay out the oToken proceeds\\n        address receiver;\\n        // oToken that is to be redeemed\\n        address otoken;\\n        // amount of oTokens that is to be redeemed\\n        uint256 amount;\\n    }\\n\\n    function getPayout(address _otoken, uint256 _amount)\\n        external\\n        view\\n        returns (uint256);\\n\\n    function operate(ActionArgs[] calldata _actions) external;\\n\\n    function getAccountVaultCounter(address owner)\\n        external\\n        view\\n        returns (uint256);\\n\\n    function oracle() external view returns (address);\\n\\n    function getVault(address _owner, uint256 _vaultId)\\n        external\\n        view\\n        returns (GammaTypes.Vault memory);\\n\\n    function getProceed(address _owner, uint256 _vaultId)\\n        external\\n        view\\n        returns (uint256);\\n\\n    function isSettlementAllowed(\\n        address _underlying,\\n        address _strike,\\n        address _collateral,\\n        uint256 _expiry\\n    ) external view returns (bool);\\n}\\n\\ninterface IOracle {\\n    function setAssetPricer(address _asset, address _pricer) external;\\n\\n    function updateAssetPricer(address _asset, address _pricer) external;\\n\\n    function getPrice(address _asset) external view returns (uint256);\\n}\\n\",\"keccak256\":\"0x148930e8fd36c64b8dbe75c2ba71117eaf4a6da5a019e08f3ff8161b274785ba\",\"license\":\"MIT\"},\"contracts/interfaces/IERC20Detailed.sol\":{\"content\":\"// SPDX-License-Identifier: MIT\\npragma solidity =0.8.4;\\n\\nimport {IERC20} from \\\"@openzeppelin/contracts/token/ERC20/IERC20.sol\\\";\\n\\ninterface IERC20Detailed is IERC20 {\\n    function decimals() external view returns (uint8);\\n\\n    function symbol() external view returns (string calldata);\\n\\n    function name() external view returns (string calldata);\\n}\\n\",\"keccak256\":\"0x90fd29862ecc4bc1f2ee3e4d5c42364c5fbcc0f43f907d2bb82665f93df0d218\",\"license\":\"MIT\"},\"contracts/interfaces/IGnosisAuction.sol\":{\"content\":\"// SPDX-License-Identifier: MIT\\npragma solidity =0.8.4;\\n\\nimport {IERC20} from \\\"@openzeppelin/contracts/token/ERC20/IERC20.sol\\\";\\n\\nlibrary AuctionType {\\n    struct AuctionData {\\n        IERC20 auctioningToken;\\n        IERC20 biddingToken;\\n        uint256 orderCancellationEndDate;\\n        uint256 auctionEndDate;\\n        bytes32 initialAuctionOrder;\\n        uint256 minimumBiddingAmountPerOrder;\\n        uint256 interimSumBidAmount;\\n        bytes32 interimOrder;\\n        bytes32 clearingPriceOrder;\\n        uint96 volumeClearingPriceOrder;\\n        bool minFundingThresholdNotReached;\\n        bool isAtomicClosureAllowed;\\n        uint256 feeNumerator;\\n        uint256 minFundingThreshold;\\n    }\\n}\\n\\ninterface IGnosisAuction {\\n    function initiateAuction(\\n        address _auctioningToken,\\n        address _biddingToken,\\n        uint256 orderCancellationEndDate,\\n        uint256 auctionEndDate,\\n        uint96 _auctionedSellAmount,\\n        uint96 _minBuyAmount,\\n        uint256 minimumBiddingAmountPerOrder,\\n        uint256 minFundingThreshold,\\n        bool isAtomicClosureAllowed,\\n        address accessManagerContract,\\n        bytes memory accessManagerContractData\\n    ) external returns (uint256);\\n\\n    function auctionCounter() external view returns (uint256);\\n\\n    function auctionData(uint256 auctionId)\\n        external\\n        view\\n        returns (AuctionType.AuctionData memory);\\n\\n    function auctionAccessManager(uint256 auctionId)\\n        external\\n        view\\n        returns (address);\\n\\n    function auctionAccessData(uint256 auctionId)\\n        external\\n        view\\n        returns (bytes memory);\\n\\n    function FEE_DENOMINATOR() external view returns (uint256);\\n\\n    function feeNumerator() external view returns (uint256);\\n\\n    function settleAuction(uint256 auctionId) external returns (bytes32);\\n\\n    function placeSellOrders(\\n        uint256 auctionId,\\n        uint96[] memory _minBuyAmounts,\\n        uint96[] memory _sellAmounts,\\n        bytes32[] memory _prevSellOrders,\\n        bytes calldata allowListCallData\\n    ) external returns (uint64);\\n\\n    function claimFromParticipantOrder(\\n        uint256 auctionId,\\n        bytes32[] memory orders\\n    ) external returns (uint256, uint256);\\n}\\n\",\"keccak256\":\"0x226639ee48018ec78891a829816799c9b9f6bbec7e84c4ca43cdc7dc8a07628f\",\"license\":\"MIT\"},\"contracts/interfaces/IOptionsPurchaseQueue.sol\":{\"content\":\"// SPDX-License-Identifier: MIT\\npragma solidity >=0.8.0;\\n\\ninterface IOptionsPurchaseQueue {\\n    /**\\n     * @dev Contains purchase request info\\n     * @param optionsAmount Amount of options to purchase\\n     * @param premiums Total premiums the buyer is spending to purchase the options (optionsAmount * ceilingPrice)\\n     *  We need to track the premiums here since the ceilingPrice could change between the time the purchase was\\n     *  requested and when the options are sold\\n     * @param buyer The buyer requesting this purchase\\n     */\\n    struct Purchase {\\n        uint128 optionsAmount; // Slot 0\\n        uint128 premiums;\\n        address buyer; // Slot 1\\n    }\\n\\n    function purchases(address, uint256)\\n        external\\n        view\\n        returns (\\n            uint128,\\n            uint128,\\n            address\\n        );\\n\\n    function totalOptionsAmount(address) external view returns (uint256);\\n\\n    function vaultAllocatedOptions(address) external view returns (uint256);\\n\\n    function whitelistedBuyer(address) external view returns (bool);\\n\\n    function minPurchaseAmount(address) external view returns (uint256);\\n\\n    function ceilingPrice(address) external view returns (uint256);\\n\\n    function getPurchases(address vault)\\n        external\\n        view\\n        returns (Purchase[] memory);\\n\\n    function getPremiums(address vault, uint256 optionsAmount)\\n        external\\n        view\\n        returns (uint256);\\n\\n    function getOptionsAllocation(address vault, uint256 allocatedOptions)\\n        external\\n        view\\n        returns (uint256);\\n\\n    function requestPurchase(address vault, uint256 optionsAmount)\\n        external\\n        returns (uint256);\\n\\n    function allocateOptions(uint256 allocatedOptions)\\n        external\\n        returns (uint256);\\n\\n    function sellToBuyers(uint256 settlementPrice) external returns (uint256);\\n\\n    function cancelAllPurchases(address vault) external;\\n\\n    function addWhitelist(address buyer) external;\\n\\n    function removeWhitelist(address buyer) external;\\n\\n    function setCeilingPrice(address vault, uint256 price) external;\\n\\n    function setMinPurchaseAmount(address vault, uint256 amount) external;\\n}\\n\",\"keccak256\":\"0x3033ae23c42a0da011d8e43d911ec7d999ccbc18a73e24098dfd202a71000086\",\"license\":\"MIT\"},\"contracts/interfaces/IRibbon.sol\":{\"content\":\"// SPDX-License-Identifier: MIT\\npragma solidity =0.8.4;\\nimport {Vault} from \\\"../libraries/Vault.sol\\\";\\n\\ninterface IRibbonVault {\\n    function deposit(uint256 amount) external;\\n\\n    function depositETH() external payable;\\n\\n    function cap() external view returns (uint256);\\n\\n    function depositFor(uint256 amount, address creditor) external;\\n\\n    function vaultParams() external view returns (Vault.VaultParams memory);\\n}\\n\\ninterface IStrikeSelection {\\n    function getStrikePrice(uint256 expiryTimestamp, bool isPut)\\n        external\\n        view\\n        returns (uint256, uint256);\\n\\n    function delta() external view returns (uint256);\\n}\\n\\ninterface IOptionsPremiumPricer {\\n    function getPremium(\\n        uint256 strikePrice,\\n        uint256 timeToExpiry,\\n        bool isPut\\n    ) external view returns (uint256);\\n\\n    function getPremiumInStables(\\n        uint256 strikePrice,\\n        uint256 timeToExpiry,\\n        bool isPut\\n    ) external view returns (uint256);\\n\\n    function getOptionDelta(\\n        uint256 spotPrice,\\n        uint256 strikePrice,\\n        uint256 volatility,\\n        uint256 expiryTimestamp\\n    ) external view returns (uint256 delta);\\n\\n    function getUnderlyingPrice() external view returns (uint256);\\n\\n    function priceOracle() external view returns (address);\\n\\n    function volatilityOracle() external view returns (address);\\n\\n    function optionId() external view returns (bytes32);\\n}\\n\",\"keccak256\":\"0xd9ffea587ce992000d8a9f8d4b1bc8c40008633c35121b3d11ab8c6a7dd5ecbc\",\"license\":\"MIT\"},\"contracts/interfaces/IRibbonThetaVault.sol\":{\"content\":\"// SPDX-License-Identifier: MIT\\npragma solidity =0.8.4;\\n\\nimport {Vault} from \\\"../libraries/Vault.sol\\\";\\n\\ninterface IRibbonThetaVault {\\n    function currentOption() external view returns (address);\\n\\n    function nextOption() external view returns (address);\\n\\n    function vaultParams() external view returns (Vault.VaultParams memory);\\n\\n    function vaultState() external view returns (Vault.VaultState memory);\\n\\n    function optionState() external view returns (Vault.OptionState memory);\\n\\n    function optionAuctionID() external view returns (uint256);\\n\\n    function pricePerShare() external view returns (uint256);\\n\\n    function roundPricePerShare(uint256) external view returns (uint256);\\n}\\n\",\"keccak256\":\"0x971c0b438d7931eb53ae8f57a15304db62917845b36ebef3d501a5f1628c82e3\",\"license\":\"MIT\"},\"contracts/interfaces/ISwap.sol\":{\"content\":\"// SPDX-License-Identifier: MIT\\n\\npragma solidity =0.8.4;\\n\\ninterface ISwap {\\n    struct Offer {\\n        // 32 byte slot 1, partial fill\\n        // Seller wallet address\\n        address seller;\\n        // 32 byte slot 2\\n        // Addess of oToken\\n        address oToken;\\n        // Price per oToken denominated in biddingToken\\n        uint96 minPrice;\\n        // 32 byte slot 3\\n        // ERC20 Token to bid for oToken\\n        address biddingToken;\\n        // Minimum oToken amount acceptable for a single bid\\n        uint96 minBidSize;\\n        // 32 byte slot 4\\n        // Total available oToken amount\\n        uint128 totalSize;\\n        // Remaining available oToken amount\\n        // This figure is updated after each successfull swap\\n        uint128 availableSize;\\n        // 32 byte slot 5\\n        // Amount of biddingToken received\\n        // This figure is updated after each successfull swap\\n        uint256 totalSales;\\n    }\\n\\n    struct Bid {\\n        // ID assigned to offers\\n        uint256 swapId;\\n        // Number only used once for each wallet\\n        uint256 nonce;\\n        // Signer wallet address\\n        address signerWallet;\\n        // Amount of biddingToken offered by signer\\n        uint256 sellAmount;\\n        // Amount of oToken requested by signer\\n        uint256 buyAmount;\\n        // Referrer wallet address\\n        address referrer;\\n        // Signature recovery id\\n        uint8 v;\\n        // r portion of the ECSDA signature\\n        bytes32 r;\\n        // s portion of the ECSDA signature\\n        bytes32 s;\\n    }\\n\\n    struct OfferDetails {\\n        // Seller wallet address\\n        address seller;\\n        // Addess of oToken\\n        address oToken;\\n        // Price per oToken denominated in biddingToken\\n        uint256 minPrice;\\n        // ERC20 Token to bid for oToken\\n        address biddingToken;\\n        // Minimum oToken amount acceptable for a single bid\\n        uint256 minBidSize;\\n    }\\n\\n    event Swap(\\n        uint256 indexed swapId,\\n        uint256 nonce,\\n        address indexed signerWallet,\\n        uint256 signerAmount,\\n        uint256 sellerAmount,\\n        address referrer,\\n        uint256 feeAmount\\n    );\\n\\n    event NewOffer(\\n        uint256 swapId,\\n        address seller,\\n        address oToken,\\n        address biddingToken,\\n        uint256 minPrice,\\n        uint256 minBidSize,\\n        uint256 totalSize\\n    );\\n\\n    event SetFee(address referrer, uint256 fee);\\n\\n    event SettleOffer(uint256 swapId);\\n\\n    event Cancel(uint256 indexed nonce, address indexed signerWallet);\\n\\n    function createOffer(\\n        address oToken,\\n        address biddingToken,\\n        uint96 minPrice,\\n        uint96 minBidSize,\\n        uint128 totalSize\\n    ) external returns (uint256 swapId);\\n\\n    function settleOffer(uint256 swapId, Bid[] calldata bids) external;\\n\\n    function cancelNonce(uint256[] calldata nonces) external;\\n\\n    function check(Bid calldata bid)\\n        external\\n        view\\n        returns (uint256, bytes32[] memory);\\n\\n    function averagePriceForOffer(uint256 swapId)\\n        external\\n        view\\n        returns (uint256);\\n\\n    function nonceUsed(address, uint256) external view returns (bool);\\n}\\n\",\"keccak256\":\"0x19cde9a5896a65884d0296b03e47f09e79b22743d083567486e8a19bb55e7529\",\"license\":\"MIT\"},\"contracts/libraries/GnosisAuction.sol\":{\"content\":\"// SPDX-License-Identifier: MIT\\npragma solidity =0.8.4;\\n\\nimport {SafeMath} from \\\"@openzeppelin/contracts/utils/math/SafeMath.sol\\\";\\nimport {IERC20} from \\\"@openzeppelin/contracts/token/ERC20/IERC20.sol\\\";\\nimport {\\n    SafeERC20\\n} from \\\"@openzeppelin/contracts/token/ERC20/utils/SafeERC20.sol\\\";\\nimport {DSMath} from \\\"../vendor/DSMath.sol\\\";\\nimport {IGnosisAuction} from \\\"../interfaces/IGnosisAuction.sol\\\";\\nimport {IOtoken} from \\\"../interfaces/GammaInterface.sol\\\";\\nimport {IOptionsPremiumPricer} from \\\"../interfaces/IRibbon.sol\\\";\\nimport {Vault} from \\\"./Vault.sol\\\";\\nimport {IRibbonThetaVault} from \\\"../interfaces/IRibbonThetaVault.sol\\\";\\n\\nlibrary GnosisAuction {\\n    using SafeMath for uint256;\\n    using SafeERC20 for IERC20;\\n\\n    event InitiateGnosisAuction(\\n        address indexed auctioningToken,\\n        address indexed biddingToken,\\n        uint256 auctionCounter,\\n        address indexed manager\\n    );\\n\\n    event PlaceAuctionBid(\\n        uint256 auctionId,\\n        address indexed auctioningToken,\\n        uint256 sellAmount,\\n        uint256 buyAmount,\\n        address indexed bidder\\n    );\\n\\n    struct AuctionDetails {\\n        address oTokenAddress;\\n        address gnosisEasyAuction;\\n        address asset;\\n        uint256 assetDecimals;\\n        uint256 oTokenPremium;\\n        uint256 duration;\\n    }\\n\\n    struct BidDetails {\\n        address oTokenAddress;\\n        address gnosisEasyAuction;\\n        address asset;\\n        uint256 assetDecimals;\\n        uint256 auctionId;\\n        uint256 lockedBalance;\\n        uint256 optionAllocation;\\n        uint256 optionPremium;\\n        address bidder;\\n    }\\n\\n    function startAuction(AuctionDetails calldata auctionDetails)\\n        internal\\n        returns (uint256 auctionID)\\n    {\\n        uint256 oTokenSellAmount =\\n            getOTokenSellAmount(auctionDetails.oTokenAddress);\\n        require(oTokenSellAmount > 0, \\\"No otokens to sell\\\");\\n\\n        IERC20(auctionDetails.oTokenAddress).safeApprove(\\n            auctionDetails.gnosisEasyAuction,\\n            IERC20(auctionDetails.oTokenAddress).balanceOf(address(this))\\n        );\\n\\n        // minBidAmount is total oTokens to sell * premium per oToken\\n        // shift decimals to correspond to decimals of USDC for puts\\n        // and underlying for calls\\n        uint256 minBidAmount =\\n            DSMath.wmul(\\n                oTokenSellAmount.mul(10**10),\\n                auctionDetails.oTokenPremium\\n            );\\n\\n        minBidAmount = auctionDetails.assetDecimals > 18\\n            ? minBidAmount.mul(10**(auctionDetails.assetDecimals.sub(18)))\\n            : minBidAmount.div(\\n                10**(uint256(18).sub(auctionDetails.assetDecimals))\\n            );\\n\\n        require(\\n            minBidAmount <= type(uint96).max,\\n            \\\"optionPremium * oTokenSellAmount > type(uint96) max value!\\\"\\n        );\\n\\n        uint256 auctionEnd = block.timestamp.add(auctionDetails.duration);\\n\\n        auctionID = IGnosisAuction(auctionDetails.gnosisEasyAuction)\\n            .initiateAuction(\\n            // address of oToken we minted and are selling\\n            auctionDetails.oTokenAddress,\\n            // address of asset we want in exchange for oTokens. Should match vault `asset`\\n            auctionDetails.asset,\\n            // orders can be cancelled at any time during the auction\\n            auctionEnd,\\n            // order will last for `duration`\\n            auctionEnd,\\n            // we are selling all of the otokens minus a fee taken by gnosis\\n            uint96(oTokenSellAmount),\\n            // the minimum we are willing to sell all the oTokens for. A discount is applied on black-scholes price\\n            uint96(minBidAmount),\\n            // the minimum bidding amount must be 1 * 10 ** -assetDecimals\\n            1,\\n            // the min funding threshold\\n            0,\\n            // no atomic closure\\n            false,\\n            // access manager contract\\n            address(0),\\n            // bytes for storing info like a whitelist for who can bid\\n            bytes(\\\"\\\")\\n        );\\n\\n        emit InitiateGnosisAuction(\\n            auctionDetails.oTokenAddress,\\n            auctionDetails.asset,\\n            auctionID,\\n            msg.sender\\n        );\\n    }\\n\\n    function placeBid(BidDetails calldata bidDetails)\\n        internal\\n        returns (\\n            uint256 sellAmount,\\n            uint256 buyAmount,\\n            uint64 userId\\n        )\\n    {\\n        // calculate how much to allocate\\n        sellAmount = bidDetails\\n            .lockedBalance\\n            .mul(bidDetails.optionAllocation)\\n            .div(100 * Vault.OPTION_ALLOCATION_MULTIPLIER);\\n\\n        // divide the `asset` sellAmount by the target premium per oToken to\\n        // get the number of oTokens to buy (8 decimals)\\n        buyAmount = sellAmount\\n            .mul(10**(bidDetails.assetDecimals.add(Vault.OTOKEN_DECIMALS)))\\n            .div(bidDetails.optionPremium)\\n            .div(10**bidDetails.assetDecimals);\\n\\n        require(\\n            sellAmount <= type(uint96).max,\\n            \\\"sellAmount > type(uint96) max value!\\\"\\n        );\\n        require(\\n            buyAmount <= type(uint96).max,\\n            \\\"buyAmount > type(uint96) max value!\\\"\\n        );\\n\\n        // approve that amount\\n        IERC20(bidDetails.asset).safeApprove(\\n            bidDetails.gnosisEasyAuction,\\n            sellAmount\\n        );\\n\\n        uint96[] memory _minBuyAmounts = new uint96[](1);\\n        uint96[] memory _sellAmounts = new uint96[](1);\\n        bytes32[] memory _prevSellOrders = new bytes32[](1);\\n        _minBuyAmounts[0] = uint96(buyAmount);\\n        _sellAmounts[0] = uint96(sellAmount);\\n        _prevSellOrders[\\n            0\\n        ] = 0x0000000000000000000000000000000000000000000000000000000000000001;\\n\\n        // place sell order with that amount\\n        userId = IGnosisAuction(bidDetails.gnosisEasyAuction).placeSellOrders(\\n            bidDetails.auctionId,\\n            _minBuyAmounts,\\n            _sellAmounts,\\n            _prevSellOrders,\\n            \\\"0x\\\"\\n        );\\n\\n        emit PlaceAuctionBid(\\n            bidDetails.auctionId,\\n            bidDetails.oTokenAddress,\\n            sellAmount,\\n            buyAmount,\\n            bidDetails.bidder\\n        );\\n\\n        return (sellAmount, buyAmount, userId);\\n    }\\n\\n    function claimAuctionOtokens(\\n        Vault.AuctionSellOrder calldata auctionSellOrder,\\n        address gnosisEasyAuction,\\n        address counterpartyThetaVault\\n    ) internal {\\n        bytes32 order =\\n            encodeOrder(\\n                auctionSellOrder.userId,\\n                auctionSellOrder.buyAmount,\\n                auctionSellOrder.sellAmount\\n            );\\n        bytes32[] memory orders = new bytes32[](1);\\n        orders[0] = order;\\n        IGnosisAuction(gnosisEasyAuction).claimFromParticipantOrder(\\n            IRibbonThetaVault(counterpartyThetaVault).optionAuctionID(),\\n            orders\\n        );\\n    }\\n\\n    function getOTokenSellAmount(address oTokenAddress)\\n        internal\\n        view\\n        returns (uint256)\\n    {\\n        // We take our current oToken balance. That will be our sell amount\\n        // but otokens will be transferred to gnosis.\\n        uint256 oTokenSellAmount =\\n            IERC20(oTokenAddress).balanceOf(address(this));\\n\\n        require(\\n            oTokenSellAmount <= type(uint96).max,\\n            \\\"oTokenSellAmount > type(uint96) max value!\\\"\\n        );\\n\\n        return oTokenSellAmount;\\n    }\\n\\n    function getOTokenPremiumInStables(\\n        address oTokenAddress,\\n        address optionsPremiumPricer,\\n        uint256 premiumDiscount\\n    ) internal view returns (uint256) {\\n        IOtoken newOToken = IOtoken(oTokenAddress);\\n        IOptionsPremiumPricer premiumPricer =\\n            IOptionsPremiumPricer(optionsPremiumPricer);\\n\\n        // Apply black-scholes formula (from rvol library) to option given its features\\n        // and get price for 100 contracts denominated USDC for both call and put options\\n        uint256 optionPremium =\\n            premiumPricer.getPremiumInStables(\\n                newOToken.strikePrice(),\\n                newOToken.expiryTimestamp(),\\n                newOToken.isPut()\\n            );\\n\\n        // Apply a discount to incentivize arbitraguers\\n        optionPremium = optionPremium.mul(premiumDiscount).div(\\n            100 * Vault.PREMIUM_DISCOUNT_MULTIPLIER\\n        );\\n\\n        require(\\n            optionPremium <= type(uint96).max,\\n            \\\"optionPremium > type(uint96) max value!\\\"\\n        );\\n\\n        return optionPremium;\\n    }\\n\\n    function encodeOrder(\\n        uint64 userId,\\n        uint96 buyAmount,\\n        uint96 sellAmount\\n    ) internal pure returns (bytes32) {\\n        return\\n            bytes32(\\n                (uint256(userId) << 192) +\\n                    (uint256(buyAmount) << 96) +\\n                    uint256(sellAmount)\\n            );\\n    }\\n}\\n\",\"keccak256\":\"0xfbe9e9b0da571d9b83545d3ae71827da0f91bd1c68c6b68955907e6e967e4972\",\"license\":\"MIT\"},\"contracts/libraries/ShareMath.sol\":{\"content\":\"// SPDX-License-Identifier: MIT\\npragma solidity =0.8.4;\\n\\nimport {SafeMath} from \\\"@openzeppelin/contracts/utils/math/SafeMath.sol\\\";\\nimport {Vault} from \\\"./Vault.sol\\\";\\n\\nlibrary ShareMath {\\n    using SafeMath for uint256;\\n\\n    uint256 internal constant PLACEHOLDER_UINT = 1;\\n\\n    function assetToShares(\\n        uint256 assetAmount,\\n        uint256 assetPerShare,\\n        uint256 decimals\\n    ) internal pure returns (uint256) {\\n        // If this throws, it means that vault's roundPricePerShare[currentRound] has not been set yet\\n        // which should never happen.\\n        // Has to be larger than 1 because `1` is used in `initRoundPricePerShares` to prevent cold writes.\\n        require(assetPerShare > PLACEHOLDER_UINT, \\\"Invalid assetPerShare\\\");\\n\\n        return assetAmount.mul(10**decimals).div(assetPerShare);\\n    }\\n\\n    function sharesToAsset(\\n        uint256 shares,\\n        uint256 assetPerShare,\\n        uint256 decimals\\n    ) internal pure returns (uint256) {\\n        // If this throws, it means that vault's roundPricePerShare[currentRound] has not been set yet\\n        // which should never happen.\\n        // Has to be larger than 1 because `1` is used in `initRoundPricePerShares` to prevent cold writes.\\n        require(assetPerShare > PLACEHOLDER_UINT, \\\"Invalid assetPerShare\\\");\\n\\n        return shares.mul(assetPerShare).div(10**decimals);\\n    }\\n\\n    /**\\n     * @notice Returns the shares unredeemed by the user given their DepositReceipt\\n     * @param depositReceipt is the user's deposit receipt\\n     * @param currentRound is the `round` stored on the vault\\n     * @param assetPerShare is the price in asset per share\\n     * @param decimals is the number of decimals the asset/shares use\\n     * @return unredeemedShares is the user's virtual balance of shares that are owed\\n     */\\n    function getSharesFromReceipt(\\n        Vault.DepositReceipt memory depositReceipt,\\n        uint256 currentRound,\\n        uint256 assetPerShare,\\n        uint256 decimals\\n    ) internal pure returns (uint256 unredeemedShares) {\\n        if (depositReceipt.round > 0 && depositReceipt.round < currentRound) {\\n            uint256 sharesFromRound =\\n                assetToShares(depositReceipt.amount, assetPerShare, decimals);\\n\\n            return\\n                uint256(depositReceipt.unredeemedShares).add(sharesFromRound);\\n        }\\n        return depositReceipt.unredeemedShares;\\n    }\\n\\n    function pricePerShare(\\n        uint256 totalSupply,\\n        uint256 totalBalance,\\n        uint256 pendingAmount,\\n        uint256 decimals\\n    ) internal pure returns (uint256) {\\n        uint256 singleShare = 10**decimals;\\n        return\\n            totalSupply > 0\\n                ? singleShare.mul(totalBalance.sub(pendingAmount)).div(\\n                    totalSupply\\n                )\\n                : singleShare;\\n    }\\n\\n    /************************************************\\n     *  HELPERS\\n     ***********************************************/\\n\\n    function assertUint104(uint256 num) internal pure {\\n        require(num <= type(uint104).max, \\\"Overflow uint104\\\");\\n    }\\n\\n    function assertUint128(uint256 num) internal pure {\\n        require(num <= type(uint128).max, \\\"Overflow uint128\\\");\\n    }\\n}\\n\",\"keccak256\":\"0x90bc4b56ee48f314d1e326903bdb2926bed143fa4e6867a7d44975503106bf56\",\"license\":\"MIT\"},\"contracts/libraries/SupportsNonCompliantERC20.sol\":{\"content\":\"// SPDX-License-Identifier: MIT\\npragma solidity =0.8.4;\\nimport {IERC20} from \\\"@openzeppelin/contracts/token/ERC20/IERC20.sol\\\";\\nimport {\\n    SafeERC20\\n} from \\\"@openzeppelin/contracts/token/ERC20/utils/SafeERC20.sol\\\";\\n\\n/**\\n * This library supports ERC20s that have quirks in their behavior.\\n * One such ERC20 is USDT, which requires allowance to be 0 before calling approve.\\n * We plan to update this library with ERC20s that display such idiosyncratic behavior.\\n */\\nlibrary SupportsNonCompliantERC20 {\\n    address private constant USDT = 0xdAC17F958D2ee523a2206206994597C13D831ec7;\\n\\n    function safeApproveNonCompliant(\\n        IERC20 token,\\n        address spender,\\n        uint256 amount\\n    ) internal {\\n        if (address(token) == USDT) {\\n            SafeERC20.safeApprove(token, spender, 0);\\n        }\\n        SafeERC20.safeApprove(token, spender, amount);\\n    }\\n}\\n\",\"keccak256\":\"0xda967c8a0bcbdf15b1b60c4cba1d0b12aae75431570dfbb5fb06b64162c83cb0\",\"license\":\"MIT\"},\"contracts/libraries/Vault.sol\":{\"content\":\"// SPDX-License-Identifier: MIT\\npragma solidity =0.8.4;\\n\\nlibrary Vault {\\n    /************************************************\\n     *  IMMUTABLES & CONSTANTS\\n     ***********************************************/\\n\\n    // Fees are 6-decimal places. For example: 20 * 10**6 = 20%\\n    uint256 internal constant FEE_MULTIPLIER = 10**6;\\n\\n    // Premium discount has 1-decimal place. For example: 80 * 10**1 = 80%. Which represents a 20% discount.\\n    uint256 internal constant PREMIUM_DISCOUNT_MULTIPLIER = 10;\\n\\n    // Otokens have 8 decimal places.\\n    uint256 internal constant OTOKEN_DECIMALS = 8;\\n\\n    // Percentage of funds allocated to options is 2 decimal places. 10 * 10**2 = 10%\\n    uint256 internal constant OPTION_ALLOCATION_MULTIPLIER = 10**2;\\n\\n    // Placeholder uint value to prevent cold writes\\n    uint256 internal constant PLACEHOLDER_UINT = 1;\\n\\n    struct VaultParams {\\n        // Option type the vault is selling\\n        bool isPut;\\n        // Token decimals for vault shares\\n        uint8 decimals;\\n        // Asset used in Theta / Delta Vault\\n        address asset;\\n        // Underlying asset of the options sold by vault\\n        address underlying;\\n        // Minimum supply of the vault shares issued, for ETH it's 10**10\\n        uint56 minimumSupply;\\n        // Vault cap\\n        uint104 cap;\\n    }\\n\\n    struct OptionState {\\n        // Option that the vault is shorting / longing in the next cycle\\n        address nextOption;\\n        // Option that the vault is currently shorting / longing\\n        address currentOption;\\n        // The timestamp when the `nextOption` can be used by the vault\\n        uint32 nextOptionReadyAt;\\n    }\\n\\n    struct VaultState {\\n        // 32 byte slot 1\\n        //  Current round number. `round` represents the number of `period`s elapsed.\\n        uint16 round;\\n        // Amount that is currently locked for selling options\\n        uint104 lockedAmount;\\n        // Amount that was locked for selling options in the previous round\\n        // used for calculating performance fee deduction\\n        uint104 lastLockedAmount;\\n        // 32 byte slot 2\\n        // Stores the total tally of how much of `asset` there is\\n        // to be used to mint rTHETA tokens\\n        uint128 totalPending;\\n        // Total amount of queued withdrawal shares from previous rounds (doesn't include the current round)\\n        uint128 queuedWithdrawShares;\\n    }\\n\\n    struct DepositReceipt {\\n        // Maximum of 65535 rounds. Assuming 1 round is 7 days, maximum is 1256 years.\\n        uint16 round;\\n        // Deposit amount, max 20,282,409,603,651 or 20 trillion ETH deposit\\n        uint104 amount;\\n        // Unredeemed shares balance\\n        uint128 unredeemedShares;\\n    }\\n\\n    struct Withdrawal {\\n        // Maximum of 65535 rounds. Assuming 1 round is 7 days, maximum is 1256 years.\\n        uint16 round;\\n        // Number of shares withdrawn\\n        uint128 shares;\\n    }\\n\\n    struct AuctionSellOrder {\\n        // Amount of `asset` token offered in auction\\n        uint96 sellAmount;\\n        // Amount of oToken requested in auction\\n        uint96 buyAmount;\\n        // User Id of delta vault in latest gnosis auction\\n        uint64 userId;\\n    }\\n}\\n\",\"keccak256\":\"0x3119c096a02be6137015be605caf65412e0dd4b7df5f25e73bab4f88fddfa5d6\",\"license\":\"MIT\"},\"contracts/libraries/VaultLifecycleWithSwap.sol\":{\"content\":\"// SPDX-License-Identifier: MIT\\npragma solidity =0.8.4;\\n\\nimport {SafeMath} from \\\"@openzeppelin/contracts/utils/math/SafeMath.sol\\\";\\nimport {IERC20} from \\\"@openzeppelin/contracts/token/ERC20/IERC20.sol\\\";\\nimport {\\n    SafeERC20\\n} from \\\"@openzeppelin/contracts/token/ERC20/utils/SafeERC20.sol\\\";\\nimport {Vault} from \\\"./Vault.sol\\\";\\nimport {ShareMath} from \\\"./ShareMath.sol\\\";\\nimport {IStrikeSelection} from \\\"../interfaces/IRibbon.sol\\\";\\nimport {GnosisAuction} from \\\"./GnosisAuction.sol\\\";\\nimport {\\n    IOtokenFactory,\\n    IOtoken,\\n    IController,\\n    GammaTypes\\n} from \\\"../interfaces/GammaInterface.sol\\\";\\nimport {IERC20Detailed} from \\\"../interfaces/IERC20Detailed.sol\\\";\\nimport {ISwap} from \\\"../interfaces/ISwap.sol\\\";\\nimport {IOptionsPurchaseQueue} from \\\"../interfaces/IOptionsPurchaseQueue.sol\\\";\\nimport {SupportsNonCompliantERC20} from \\\"./SupportsNonCompliantERC20.sol\\\";\\nimport {IOptionsPremiumPricer} from \\\"../interfaces/IRibbon.sol\\\";\\n\\nlibrary VaultLifecycleWithSwap {\\n    using SafeMath for uint256;\\n    using SupportsNonCompliantERC20 for IERC20;\\n    using SafeERC20 for IERC20;\\n\\n    struct CommitParams {\\n        address OTOKEN_FACTORY;\\n        address USDC;\\n        address currentOption;\\n        uint256 delay;\\n        uint16 lastStrikeOverrideRound;\\n        uint256 overriddenStrikePrice;\\n        address strikeSelection;\\n        address optionsPremiumPricer;\\n        uint256 premiumDiscount;\\n    }\\n\\n    /**\\n     * @notice Sets the next option the vault will be shorting, and calculates its premium for the auction\\n     * @param commitParams is the struct with details on previous option and strike selection details\\n     * @param vaultParams is the struct with vault general data\\n     * @param vaultState is the struct with vault accounting state\\n     * @return otokenAddress is the address of the new option\\n     * @return premium is the premium of the new option\\n     * @return strikePrice is the strike price of the new option\\n     * @return delta is the delta of the new option\\n     */\\n    function commitNextOption(\\n        CommitParams calldata commitParams,\\n        Vault.VaultParams storage vaultParams,\\n        Vault.VaultState storage vaultState\\n    )\\n        external\\n        returns (\\n            address otokenAddress,\\n            uint256 premium,\\n            uint256 strikePrice,\\n            uint256 delta\\n        )\\n    {\\n        uint256 expiry = getNextExpiry(commitParams.currentOption);\\n\\n        IStrikeSelection selection =\\n            IStrikeSelection(commitParams.strikeSelection);\\n\\n        bool isPut = vaultParams.isPut;\\n        address underlying = vaultParams.underlying;\\n        address asset = vaultParams.asset;\\n\\n        (strikePrice, delta) = commitParams.lastStrikeOverrideRound ==\\n            vaultState.round\\n            ? (commitParams.overriddenStrikePrice, selection.delta())\\n            : selection.getStrikePrice(expiry, isPut);\\n\\n        require(strikePrice != 0, \\\"!strikePrice\\\");\\n\\n        // retrieve address if option already exists, or deploy it\\n        otokenAddress = getOrDeployOtoken(\\n            commitParams,\\n            vaultParams,\\n            underlying,\\n            asset,\\n            strikePrice,\\n            expiry,\\n            isPut\\n        );\\n\\n        // get the black scholes premium of the option\\n        premium = _getOTokenPremium(\\n            otokenAddress,\\n            commitParams.optionsPremiumPricer,\\n            commitParams.premiumDiscount\\n        );\\n\\n        require(premium > 0, \\\"!premium\\\");\\n\\n        return (otokenAddress, premium, strikePrice, delta);\\n    }\\n\\n    /**\\n     * @notice Verify the otoken has the correct parameters to prevent vulnerability to opyn contract changes\\n     * @param otokenAddress is the address of the otoken\\n     * @param vaultParams is the struct with vault general data\\n     * @param collateralAsset is the address of the collateral asset\\n     * @param USDC is the address of usdc\\n     * @param delay is the delay between commitAndClose and rollToNextOption\\n     */\\n    function verifyOtoken(\\n        address otokenAddress,\\n        Vault.VaultParams storage vaultParams,\\n        address collateralAsset,\\n        address USDC,\\n        uint256 delay\\n    ) private view {\\n        require(otokenAddress != address(0), \\\"!otokenAddress\\\");\\n\\n        IOtoken otoken = IOtoken(otokenAddress);\\n        require(otoken.isPut() == vaultParams.isPut, \\\"Type mismatch\\\");\\n        require(\\n            otoken.underlyingAsset() == vaultParams.underlying,\\n            \\\"Wrong underlyingAsset\\\"\\n        );\\n        require(\\n            otoken.collateralAsset() == collateralAsset,\\n            \\\"Wrong collateralAsset\\\"\\n        );\\n\\n        // we just assume all options use USDC as the strike\\n        require(otoken.strikeAsset() == USDC, \\\"strikeAsset != USDC\\\");\\n\\n        uint256 readyAt = block.timestamp.add(delay);\\n        require(otoken.expiryTimestamp() >= readyAt, \\\"Expiry before delay\\\");\\n    }\\n\\n    /**\\n     * @param decimals is the decimals of the asset\\n     * @param totalBalance is the vault's total asset balance\\n     * @param currentShareSupply is the supply of the shares invoked with totalSupply()\\n     * @param lastQueuedWithdrawAmount is the amount queued for withdrawals from last round\\n     * @param performanceFee is the perf fee percent to charge on premiums\\n     * @param managementFee is the management fee percent to charge on the AUM\\n     */\\n    struct CloseParams {\\n        uint256 decimals;\\n        uint256 totalBalance;\\n        uint256 currentShareSupply;\\n        uint256 lastQueuedWithdrawAmount;\\n        uint256 performanceFee;\\n        uint256 managementFee;\\n        uint256 currentQueuedWithdrawShares;\\n    }\\n\\n    /**\\n     * @notice Calculate the shares to mint, new price per share, and\\n      amount of funds to re-allocate as collateral for the new round\\n     * @param vaultState is the storage variable vaultState passed from RibbonVault\\n     * @param params is the rollover parameters passed to compute the next state\\n     * @return newLockedAmount is the amount of funds to allocate for the new round\\n     * @return queuedWithdrawAmount is the amount of funds set aside for withdrawal\\n     * @return newPricePerShare is the price per share of the new round\\n     * @return mintShares is the amount of shares to mint from deposits\\n     * @return performanceFeeInAsset is the performance fee charged by vault\\n     * @return totalVaultFee is the total amount of fee charged by vault\\n     */\\n    function closeRound(\\n        Vault.VaultState storage vaultState,\\n        CloseParams calldata params\\n    )\\n        external\\n        view\\n        returns (\\n            uint256 newLockedAmount,\\n            uint256 queuedWithdrawAmount,\\n            uint256 newPricePerShare,\\n            uint256 mintShares,\\n            uint256 performanceFeeInAsset,\\n            uint256 totalVaultFee\\n        )\\n    {\\n        uint256 currentBalance = params.totalBalance;\\n        uint256 pendingAmount = vaultState.totalPending;\\n        // Total amount of queued withdrawal shares from previous rounds (doesn't include the current round)\\n        uint256 lastQueuedWithdrawShares = vaultState.queuedWithdrawShares;\\n\\n        // Deduct older queued withdraws so we don't charge fees on them\\n        uint256 balanceForVaultFees =\\n            currentBalance.sub(params.lastQueuedWithdrawAmount);\\n\\n        {\\n            (performanceFeeInAsset, , totalVaultFee) = getVaultFees(\\n                balanceForVaultFees,\\n                vaultState.lastLockedAmount,\\n                vaultState.totalPending,\\n                params.performanceFee,\\n                params.managementFee\\n            );\\n        }\\n\\n        // Take into account the fee\\n        // so we can calculate the newPricePerShare\\n        currentBalance = currentBalance.sub(totalVaultFee);\\n\\n        {\\n            newPricePerShare = ShareMath.pricePerShare(\\n                params.currentShareSupply.sub(lastQueuedWithdrawShares),\\n                currentBalance.sub(params.lastQueuedWithdrawAmount),\\n                pendingAmount,\\n                params.decimals\\n            );\\n\\n            queuedWithdrawAmount = params.lastQueuedWithdrawAmount.add(\\n                ShareMath.sharesToAsset(\\n                    params.currentQueuedWithdrawShares,\\n                    newPricePerShare,\\n                    params.decimals\\n                )\\n            );\\n\\n            // After closing the short, if the options expire in-the-money\\n            // vault pricePerShare would go down because vault's asset balance decreased.\\n            // This ensures that the newly-minted shares do not take on the loss.\\n            mintShares = ShareMath.assetToShares(\\n                pendingAmount,\\n                newPricePerShare,\\n                params.decimals\\n            );\\n        }\\n\\n        return (\\n            currentBalance.sub(queuedWithdrawAmount), // new locked balance subtracts the queued withdrawals\\n            queuedWithdrawAmount,\\n            newPricePerShare,\\n            mintShares,\\n            performanceFeeInAsset,\\n            totalVaultFee\\n        );\\n    }\\n\\n    /**\\n     * @notice Creates the actual Opyn short position by depositing collateral and minting otokens\\n     * @param gammaController is the address of the opyn controller contract\\n     * @param marginPool is the address of the opyn margin contract which holds the collateral\\n     * @param oTokenAddress is the address of the otoken to mint\\n     * @param depositAmount is the amount of collateral to deposit\\n     * @return the otoken mint amount\\n     */\\n    function createShort(\\n        address gammaController,\\n        address marginPool,\\n        address oTokenAddress,\\n        uint256 depositAmount\\n    ) external returns (uint256) {\\n        IController controller = IController(gammaController);\\n        uint256 newVaultID =\\n            (controller.getAccountVaultCounter(address(this))).add(1);\\n\\n        // An otoken's collateralAsset is the vault's `asset`\\n        // So in the context of performing Opyn short operations we call them collateralAsset\\n        IOtoken oToken = IOtoken(oTokenAddress);\\n        address collateralAsset = oToken.collateralAsset();\\n\\n        uint256 collateralDecimals =\\n            uint256(IERC20Detailed(collateralAsset).decimals());\\n        uint256 mintAmount;\\n\\n        if (oToken.isPut()) {\\n            // For minting puts, there will be instances where the full depositAmount will not be used for minting.\\n            // This is because of an issue with precision.\\n            //\\n            // For ETH put options, we are calculating the mintAmount (10**8 decimals) using\\n            // the depositAmount (10**18 decimals), which will result in truncation of decimals when scaling down.\\n            // As a result, there will be tiny amounts of dust left behind in the Opyn vault when minting put otokens.\\n            //\\n            // For simplicity's sake, we do not refund the dust back to the address(this) on minting otokens.\\n            // We retain the dust in the vault so the calling contract can withdraw the\\n            // actual locked amount + dust at settlement.\\n            //\\n            // To test this behavior, we can console.log\\n            // MarginCalculatorInterface(0x7A48d10f372b3D7c60f6c9770B91398e4ccfd3C7).getExcessCollateral(vault)\\n            // to see how much dust (or excess collateral) is left behind.\\n            mintAmount = depositAmount\\n                .mul(10**Vault.OTOKEN_DECIMALS)\\n                .mul(10**18) // we use 10**18 to give extra precision\\n                .div(oToken.strikePrice().mul(10**(10 + collateralDecimals)));\\n        } else {\\n            mintAmount = depositAmount;\\n\\n            if (collateralDecimals > 8) {\\n                uint256 scaleBy = 10**(collateralDecimals.sub(8)); // oTokens have 8 decimals\\n                if (mintAmount > scaleBy) {\\n                    mintAmount = depositAmount.div(scaleBy); // scale down from 10**18 to 10**8\\n                }\\n            }\\n        }\\n\\n        // double approve to fix non-compliant ERC20s\\n        IERC20 collateralToken = IERC20(collateralAsset);\\n        collateralToken.safeApproveNonCompliant(marginPool, depositAmount);\\n\\n        IController.ActionArgs[] memory actions =\\n            new IController.ActionArgs[](3);\\n\\n        actions[0] = IController.ActionArgs(\\n            IController.ActionType.OpenVault,\\n            address(this), // owner\\n            address(this), // receiver\\n            address(0), // asset, otoken\\n            newVaultID, // vaultId\\n            0, // amount\\n            0, //index\\n            \\\"\\\" //data\\n        );\\n\\n        actions[1] = IController.ActionArgs(\\n            IController.ActionType.DepositCollateral,\\n            address(this), // owner\\n            address(this), // address to transfer from\\n            collateralAsset, // deposited asset\\n            newVaultID, // vaultId\\n            depositAmount, // amount\\n            0, //index\\n            \\\"\\\" //data\\n        );\\n\\n        actions[2] = IController.ActionArgs(\\n            IController.ActionType.MintShortOption,\\n            address(this), // owner\\n            address(this), // address to transfer to\\n            oTokenAddress, // option address\\n            newVaultID, // vaultId\\n            mintAmount, // amount\\n            0, //index\\n            \\\"\\\" //data\\n        );\\n\\n        controller.operate(actions);\\n\\n        return mintAmount;\\n    }\\n\\n    /**\\n     * @notice Close the existing short otoken position. Currently this implementation is simple.\\n     * It closes the most recent vault opened by the contract. This assumes that the contract will\\n     * only have a single vault open at any given time. Since calling `_closeShort` deletes vaults by\\n     calling SettleVault action, this assumption should hold.\\n     * @param gammaController is the address of the opyn controller contract\\n     * @return amount of collateral redeemed from the vault\\n     */\\n    function settleShort(address gammaController) external returns (uint256) {\\n        IController controller = IController(gammaController);\\n\\n        // gets the currently active vault ID\\n        uint256 vaultID = controller.getAccountVaultCounter(address(this));\\n\\n        GammaTypes.Vault memory vault =\\n            controller.getVault(address(this), vaultID);\\n\\n        require(vault.shortOtokens.length > 0, \\\"No short\\\");\\n\\n        // An otoken's collateralAsset is the vault's `asset`\\n        // So in the context of performing Opyn short operations we call them collateralAsset\\n        IERC20 collateralToken = IERC20(vault.collateralAssets[0]);\\n\\n        // The short position has been previously closed, or all the otokens have been burned.\\n        // So we return early.\\n        if (address(collateralToken) == address(0)) {\\n            return 0;\\n        }\\n\\n        // This is equivalent to doing IERC20(vault.asset).balanceOf(address(this))\\n        uint256 startCollateralBalance =\\n            collateralToken.balanceOf(address(this));\\n\\n        // If it is after expiry, we need to settle the short position using the normal way\\n        // Delete the vault and withdraw all remaining collateral from the vault\\n        IController.ActionArgs[] memory actions =\\n            new IController.ActionArgs[](1);\\n\\n        actions[0] = IController.ActionArgs(\\n            IController.ActionType.SettleVault,\\n            address(this), // owner\\n            address(this), // address to transfer to\\n            address(0), // not used\\n            vaultID, // vaultId\\n            0, // not used\\n            0, // not used\\n            \\\"\\\" // not used\\n        );\\n\\n        controller.operate(actions);\\n\\n        uint256 endCollateralBalance = collateralToken.balanceOf(address(this));\\n\\n        return endCollateralBalance.sub(startCollateralBalance);\\n    }\\n\\n    /**\\n     * @notice Exercises the ITM option using existing long otoken position. Currently this implementation is simple.\\n     * It calls the `Redeem` action to claim the payout.\\n     * @param gammaController is the address of the opyn controller contract\\n     * @param oldOption is the address of the old option\\n     * @param asset is the address of the vault's asset\\n     * @return amount of asset received by exercising the option\\n     */\\n    function settleLong(\\n        address gammaController,\\n        address oldOption,\\n        address asset\\n    ) external returns (uint256) {\\n        IController controller = IController(gammaController);\\n\\n        uint256 oldOptionBalance = IERC20(oldOption).balanceOf(address(this));\\n\\n        if (controller.getPayout(oldOption, oldOptionBalance) == 0) {\\n            return 0;\\n        }\\n\\n        uint256 startAssetBalance = IERC20(asset).balanceOf(address(this));\\n\\n        // If it is after expiry, we need to redeem the profits\\n        IController.ActionArgs[] memory actions =\\n            new IController.ActionArgs[](1);\\n\\n        actions[0] = IController.ActionArgs(\\n            IController.ActionType.Redeem,\\n            address(0), // not used\\n            address(this), // address to send profits to\\n            oldOption, // address of otoken\\n            0, // not used\\n            oldOptionBalance, // otoken balance\\n            0, // not used\\n            \\\"\\\" // not used\\n        );\\n\\n        controller.operate(actions);\\n\\n        uint256 endAssetBalance = IERC20(asset).balanceOf(address(this));\\n\\n        return endAssetBalance.sub(startAssetBalance);\\n    }\\n\\n    /**\\n     * @notice Burn the remaining oTokens left over from auction. Currently this implementation is simple.\\n     * It burns oTokens from the most recent vault opened by the contract. This assumes that the contract will\\n     * only have a single vault open at any given time.\\n     * @param gammaController is the address of the opyn controller contract\\n     * @param currentOption is the address of the current option\\n     * @return amount of collateral redeemed by burning otokens\\n     */\\n    function burnOtokens(address gammaController, address currentOption)\\n        external\\n        returns (uint256)\\n    {\\n        uint256 numOTokensToBurn =\\n            IERC20(currentOption).balanceOf(address(this));\\n\\n        require(numOTokensToBurn > 0, \\\"No oTokens to burn\\\");\\n\\n        IController controller = IController(gammaController);\\n\\n        // gets the currently active vault ID\\n        uint256 vaultID = controller.getAccountVaultCounter(address(this));\\n\\n        GammaTypes.Vault memory vault =\\n            controller.getVault(address(this), vaultID);\\n\\n        require(vault.shortOtokens.length > 0, \\\"No short\\\");\\n\\n        IERC20 collateralToken = IERC20(vault.collateralAssets[0]);\\n\\n        uint256 startCollateralBalance =\\n            collateralToken.balanceOf(address(this));\\n\\n        // Burning `amount` of oTokens from the ribbon vault,\\n        // then withdrawing the corresponding collateral amount from the vault\\n        IController.ActionArgs[] memory actions =\\n            new IController.ActionArgs[](2);\\n\\n        actions[0] = IController.ActionArgs(\\n            IController.ActionType.BurnShortOption,\\n            address(this), // owner\\n            address(this), // address to transfer from\\n            address(vault.shortOtokens[0]), // otoken address\\n            vaultID, // vaultId\\n            numOTokensToBurn, // amount\\n            0, //index\\n            \\\"\\\" //data\\n        );\\n\\n        actions[1] = IController.ActionArgs(\\n            IController.ActionType.WithdrawCollateral,\\n            address(this), // owner\\n            address(this), // address to transfer to\\n            address(collateralToken), // withdrawn asset\\n            vaultID, // vaultId\\n            vault.collateralAmounts[0].mul(numOTokensToBurn).div(\\n                vault.shortAmounts[0]\\n            ), // amount\\n            0, //index\\n            \\\"\\\" //data\\n        );\\n\\n        controller.operate(actions);\\n\\n        uint256 endCollateralBalance = collateralToken.balanceOf(address(this));\\n\\n        return endCollateralBalance.sub(startCollateralBalance);\\n    }\\n\\n    /**\\n     * @notice Calculates the performance and management fee for this week's round\\n     * @param currentBalance is the balance of funds held on the vault after closing short\\n     * @param lastLockedAmount is the amount of funds locked from the previous round\\n     * @param pendingAmount is the pending deposit amount\\n     * @param performanceFeePercent is the performance fee pct.\\n     * @param managementFeePercent is the management fee pct.\\n     * @return performanceFeeInAsset is the performance fee\\n     * @return managementFeeInAsset is the management fee\\n     * @return vaultFee is the total fees\\n     */\\n    function getVaultFees(\\n        uint256 currentBalance,\\n        uint256 lastLockedAmount,\\n        uint256 pendingAmount,\\n        uint256 performanceFeePercent,\\n        uint256 managementFeePercent\\n    )\\n        internal\\n        pure\\n        returns (\\n            uint256 performanceFeeInAsset,\\n            uint256 managementFeeInAsset,\\n            uint256 vaultFee\\n        )\\n    {\\n        // At the first round, currentBalance=0, pendingAmount>0\\n        // so we just do not charge anything on the first round\\n        uint256 lockedBalanceSansPending =\\n            currentBalance > pendingAmount\\n                ? currentBalance.sub(pendingAmount)\\n                : 0;\\n\\n        uint256 _performanceFeeInAsset;\\n        uint256 _managementFeeInAsset;\\n        uint256 _vaultFee;\\n\\n        // Take performance fee and management fee ONLY if difference between\\n        // last week and this week's vault deposits, taking into account pending\\n        // deposits and withdrawals, is positive. If it is negative, last week's\\n        // option expired ITM past breakeven, and the vault took a loss so we\\n        // do not collect performance fee for last week\\n        if (lockedBalanceSansPending > lastLockedAmount) {\\n            _performanceFeeInAsset = performanceFeePercent > 0\\n                ? lockedBalanceSansPending\\n                    .sub(lastLockedAmount)\\n                    .mul(performanceFeePercent)\\n                    .div(100 * Vault.FEE_MULTIPLIER)\\n                : 0;\\n            _managementFeeInAsset = managementFeePercent > 0\\n                ? lockedBalanceSansPending.mul(managementFeePercent).div(\\n                    100 * Vault.FEE_MULTIPLIER\\n                )\\n                : 0;\\n\\n            _vaultFee = _performanceFeeInAsset.add(_managementFeeInAsset);\\n        }\\n\\n        return (_performanceFeeInAsset, _managementFeeInAsset, _vaultFee);\\n    }\\n\\n    /**\\n     * @notice Either retrieves the option token if it already exists, or deploy it\\n     * @param commitParams is the struct with details on previous option and strike selection details\\n     * @param vaultParams is the struct with vault general data\\n     * @param underlying is the address of the underlying asset of the option\\n     * @param collateralAsset is the address of the collateral asset of the option\\n     * @param strikePrice is the strike price of the option\\n     * @param expiry is the expiry timestamp of the option\\n     * @param isPut is whether the option is a put\\n     * @return the address of the option\\n     */\\n    function getOrDeployOtoken(\\n        CommitParams calldata commitParams,\\n        Vault.VaultParams storage vaultParams,\\n        address underlying,\\n        address collateralAsset,\\n        uint256 strikePrice,\\n        uint256 expiry,\\n        bool isPut\\n    ) internal returns (address) {\\n        IOtokenFactory factory = IOtokenFactory(commitParams.OTOKEN_FACTORY);\\n\\n        address otokenFromFactory =\\n            factory.getOtoken(\\n                underlying,\\n                commitParams.USDC,\\n                collateralAsset,\\n                strikePrice,\\n                expiry,\\n                isPut\\n            );\\n\\n        if (otokenFromFactory != address(0)) {\\n            return otokenFromFactory;\\n        }\\n\\n        address otoken =\\n            factory.createOtoken(\\n                underlying,\\n                commitParams.USDC,\\n                collateralAsset,\\n                strikePrice,\\n                expiry,\\n                isPut\\n            );\\n\\n        verifyOtoken(\\n            otoken,\\n            vaultParams,\\n            collateralAsset,\\n            commitParams.USDC,\\n            commitParams.delay\\n        );\\n\\n        return otoken;\\n    }\\n\\n    function getOTokenPremium(\\n        address oTokenAddress,\\n        address optionsPremiumPricer,\\n        uint256 premiumDiscount\\n    ) external view returns (uint256) {\\n        return\\n            _getOTokenPremium(\\n                oTokenAddress,\\n                optionsPremiumPricer,\\n                premiumDiscount\\n            );\\n    }\\n\\n    function _getOTokenPremium(\\n        address oTokenAddress,\\n        address optionsPremiumPricer,\\n        uint256 premiumDiscount\\n    ) internal view returns (uint256) {\\n        IOtoken newOToken = IOtoken(oTokenAddress);\\n        IOptionsPremiumPricer premiumPricer =\\n            IOptionsPremiumPricer(optionsPremiumPricer);\\n\\n        // Apply black-scholes formula (from rvol library) to option given its features\\n        // and get price for 100 contracts denominated in the underlying asset for call option\\n        // and USDC for put option\\n        uint256 optionPremium =\\n            premiumPricer.getPremium(\\n                newOToken.strikePrice(),\\n                newOToken.expiryTimestamp(),\\n                newOToken.isPut()\\n            );\\n\\n        // Apply a discount to incentivize arbitraguers\\n        optionPremium = optionPremium.mul(premiumDiscount).div(\\n            100 * Vault.PREMIUM_DISCOUNT_MULTIPLIER\\n        );\\n\\n        require(\\n            optionPremium <= type(uint96).max,\\n            \\\"optionPremium > type(uint96) max value!\\\"\\n        );\\n        require(optionPremium > 0, \\\"!optionPremium\\\");\\n\\n        return optionPremium;\\n    }\\n\\n    /**\\n     * @notice Creates an offer in the Swap Contract\\n     * @param currentOtoken is the current otoken address\\n     * @param currOtokenPremium is premium for each otoken\\n     * @param swapContract the address of the swap contract\\n     * @param vaultParams is the struct with vault general data\\n     * @return optionAuctionID auction id of the newly created offer\\n     */\\n    function createOffer(\\n        address currentOtoken,\\n        uint256 currOtokenPremium,\\n        address swapContract,\\n        Vault.VaultParams storage vaultParams\\n    ) external returns (uint256 optionAuctionID) {\\n        require(\\n            currOtokenPremium <= type(uint96).max,\\n            \\\"currentOtokenPremium > type(uint96) max value!\\\"\\n        );\\n        require(currOtokenPremium > 0, \\\"!currentOtokenPremium\\\");\\n\\n        uint256 oTokenBalance = IERC20(currentOtoken).balanceOf(address(this));\\n        require(\\n            oTokenBalance <= type(uint128).max,\\n            \\\"oTokenBalance > type(uint128) max value!\\\"\\n        );\\n\\n        // Use safeIncrease instead of safeApproval because safeApproval is only used for initial\\n        // approval and cannot be called again. Using safeIncrease allow us to call _createOffer\\n        // even when we are approving the same oTokens we have used before. This might happen if\\n        // we accidentally burn the oTokens before settlement.\\n        uint256 allowance =\\n            IERC20(currentOtoken).allowance(address(this), swapContract);\\n\\n        if (allowance < oTokenBalance) {\\n            IERC20(currentOtoken).safeIncreaseAllowance(\\n                swapContract,\\n                oTokenBalance.sub(allowance)\\n            );\\n        }\\n\\n        uint256 decimals = vaultParams.decimals;\\n\\n        // If total size is larger than 1, set minimum bid as 1\\n        // Otherwise, set minimum bid to one tenth the total size\\n        uint256 minBidSize =\\n            oTokenBalance > 10**decimals ? 10**decimals : oTokenBalance.div(10);\\n\\n        require(\\n            minBidSize <= type(uint96).max,\\n            \\\"minBidSize > type(uint96) max value!\\\"\\n        );\\n\\n        currOtokenPremium = decimals > 18\\n            ? currOtokenPremium.mul(10**(decimals.sub(18)))\\n            : currOtokenPremium.div(10**(uint256(18).sub(decimals)));\\n\\n        optionAuctionID = ISwap(swapContract).createOffer(\\n            currentOtoken,\\n            vaultParams.asset,\\n            uint96(currOtokenPremium),\\n            uint96(minBidSize),\\n            uint128(oTokenBalance)\\n        );\\n    }\\n\\n    /**\\n     * @notice Allocates the vault's minted options to the OptionsPurchaseQueue contract\\n     * @dev Skipped if the optionsPurchaseQueue doesn't exist\\n     * @param optionsPurchaseQueue is the OptionsPurchaseQueue contract\\n     * @param option is the minted option\\n     * @param optionsAmount is the amount of options minted\\n     * @param optionAllocation is the maximum % of options to allocate towards the purchase queue (will only allocate\\n     *  up to the amount that is on the queue)\\n     * @return allocatedOptions is the amount of options that ended up getting allocated to the OptionsPurchaseQueue\\n     */\\n    function allocateOptions(\\n        address optionsPurchaseQueue,\\n        address option,\\n        uint256 optionsAmount,\\n        uint256 optionAllocation\\n    ) external returns (uint256 allocatedOptions) {\\n        // Skip if optionsPurchaseQueue is address(0)\\n        if (optionsPurchaseQueue != address(0)) {\\n            allocatedOptions = optionsAmount.mul(optionAllocation).div(\\n                100 * Vault.OPTION_ALLOCATION_MULTIPLIER\\n            );\\n            allocatedOptions = IOptionsPurchaseQueue(optionsPurchaseQueue)\\n                .getOptionsAllocation(address(this), allocatedOptions);\\n\\n            if (allocatedOptions != 0) {\\n                IERC20(option).approve(optionsPurchaseQueue, allocatedOptions);\\n                IOptionsPurchaseQueue(optionsPurchaseQueue).allocateOptions(\\n                    allocatedOptions\\n                );\\n            }\\n        }\\n\\n        return allocatedOptions;\\n    }\\n\\n    /**\\n     * @notice Sell the allocated options to the purchase queue post auction settlement\\n     * @dev Reverts if the auction hasn't settled yet\\n     * @param optionsPurchaseQueue is the OptionsPurchaseQueue contract\\n     * @param swapContract The address of the swap settlement contract\\n     * @return totalPremiums Total premiums earnt by the vault\\n     */\\n    function sellOptionsToQueue(\\n        address optionsPurchaseQueue,\\n        address swapContract,\\n        uint256 optionAuctionID\\n    ) external returns (uint256) {\\n        uint256 settlementPrice =\\n            getAuctionSettlementPrice(swapContract, optionAuctionID);\\n        require(settlementPrice != 0, \\\"!settlementPrice\\\");\\n\\n        return\\n            IOptionsPurchaseQueue(optionsPurchaseQueue).sellToBuyers(\\n                settlementPrice\\n            );\\n    }\\n\\n    /**\\n     * @notice Gets the settlement price of a settled auction\\n     * @param swapContract The address of the swap settlement contract\\n     * @param optionAuctionID is the offer ID\\n     * @return settlementPrice Auction settlement price\\n     */\\n    function getAuctionSettlementPrice(\\n        address swapContract,\\n        uint256 optionAuctionID\\n    ) public view returns (uint256) {\\n        return ISwap(swapContract).averagePriceForOffer(optionAuctionID);\\n    }\\n\\n    /**\\n     * @notice Verify the constructor params satisfy requirements\\n     * @param owner is the owner of the vault with critical permissions\\n     * @param feeRecipient is the address to recieve vault performance and management fees\\n     * @param performanceFee is the perfomance fee pct.\\n     * @param tokenName is the name of the token\\n     * @param tokenSymbol is the symbol of the token\\n     * @param _vaultParams is the struct with vault general data\\n     */\\n    function verifyInitializerParams(\\n        address owner,\\n        address keeper,\\n        address feeRecipient,\\n        uint256 performanceFee,\\n        uint256 managementFee,\\n        string calldata tokenName,\\n        string calldata tokenSymbol,\\n        Vault.VaultParams calldata _vaultParams\\n    ) external pure {\\n        require(owner != address(0), \\\"!owner\\\");\\n        require(keeper != address(0), \\\"!keeper\\\");\\n        require(feeRecipient != address(0), \\\"!feeRecipient\\\");\\n        require(\\n            performanceFee < 100 * Vault.FEE_MULTIPLIER,\\n            \\\"performanceFee >= 100%\\\"\\n        );\\n        require(\\n            managementFee < 100 * Vault.FEE_MULTIPLIER,\\n            \\\"managementFee >= 100%\\\"\\n        );\\n        require(bytes(tokenName).length > 0, \\\"!tokenName\\\");\\n        require(bytes(tokenSymbol).length > 0, \\\"!tokenSymbol\\\");\\n\\n        require(_vaultParams.asset != address(0), \\\"!asset\\\");\\n        require(_vaultParams.underlying != address(0), \\\"!underlying\\\");\\n        require(_vaultParams.minimumSupply > 0, \\\"!minimumSupply\\\");\\n        require(_vaultParams.cap > 0, \\\"!cap\\\");\\n        require(\\n            _vaultParams.cap > _vaultParams.minimumSupply,\\n            \\\"cap has to be higher than minimumSupply\\\"\\n        );\\n    }\\n\\n    /**\\n     * @notice Gets the next option expiry timestamp\\n     * @param currentOption is the otoken address that the vault is currently writing\\n     */\\n    function getNextExpiry(address currentOption)\\n        internal\\n        view\\n        returns (uint256)\\n    {\\n        // uninitialized state\\n        if (currentOption == address(0)) {\\n            return getNextFriday(block.timestamp);\\n        }\\n        uint256 currentExpiry = IOtoken(currentOption).expiryTimestamp();\\n\\n        // After options expiry if no options are written for >1 week\\n        // We need to give the ability continue writing options\\n        if (block.timestamp > currentExpiry + 7 days) {\\n            return getNextFriday(block.timestamp);\\n        }\\n        return getNextFriday(currentExpiry);\\n    }\\n\\n    /**\\n     * @notice Gets the next options expiry timestamp\\n     * @param timestamp is the expiry timestamp of the current option\\n     * Reference: https://codereview.stackexchange.com/a/33532\\n     * Examples:\\n     * getNextFriday(week 1 thursday) -> week 1 friday\\n     * getNextFriday(week 1 friday) -> week 2 friday\\n     * getNextFriday(week 1 saturday) -> week 2 friday\\n     */\\n    function getNextFriday(uint256 timestamp) internal pure returns (uint256) {\\n        // dayOfWeek = 0 (sunday) - 6 (saturday)\\n        uint256 dayOfWeek = ((timestamp / 1 days) + 4) % 7;\\n        uint256 nextFriday = timestamp + ((7 + 5 - dayOfWeek) % 7) * 1 days;\\n        uint256 friday8am = nextFriday - (nextFriday % (24 hours)) + (8 hours);\\n\\n        // If the passed timestamp is day=Friday hour>8am, we simply increment it by a week to next Friday\\n        if (timestamp >= friday8am) {\\n            friday8am += 7 days;\\n        }\\n        return friday8am;\\n    }\\n}\\n\",\"keccak256\":\"0x88654fa79cd644b9d41614bf22e4b8bc7f9e9e5c21cb8a9882be0b77f6abaa29\",\"license\":\"MIT\"},\"contracts/vendor/DSMath.sol\":{\"content\":\"// SPDX-License-Identifier: MIT\\n\\n/// math.sol -- mixin for inline numerical wizardry\\n\\n// This program is free software: you can redistribute it and/or modify\\n// it under the terms of the GNU General Public License as published by\\n// the Free Software Foundation, either version 3 of the License, or\\n// (at your option) any later version.\\n\\n// This program is distributed in the hope that it will be useful,\\n// but WITHOUT ANY WARRANTY; without even the implied warranty of\\n// MERCHANTABILITY or FITNESS FOR A PARTICULAR PURPOSE.  See the\\n// GNU General Public License for more details.\\n\\n// You should have received a copy of the GNU General Public License\\n// along with this program.  If not, see <http://www.gnu.org/licenses/>.\\n\\npragma solidity >0.4.13;\\n\\nlibrary DSMath {\\n    function add(uint256 x, uint256 y) internal pure returns (uint256 z) {\\n        require((z = x + y) >= x, \\\"ds-math-add-overflow\\\");\\n    }\\n\\n    function sub(uint256 x, uint256 y) internal pure returns (uint256 z) {\\n        require((z = x - y) <= x, \\\"ds-math-sub-underflow\\\");\\n    }\\n\\n    function mul(uint256 x, uint256 y) internal pure returns (uint256 z) {\\n        require(y == 0 || (z = x * y) / y == x, \\\"ds-math-mul-overflow\\\");\\n    }\\n\\n    function min(uint256 x, uint256 y) internal pure returns (uint256 z) {\\n        return x <= y ? x : y;\\n    }\\n\\n    function max(uint256 x, uint256 y) internal pure returns (uint256 z) {\\n        return x >= y ? x : y;\\n    }\\n\\n    function imin(int256 x, int256 y) internal pure returns (int256 z) {\\n        return x <= y ? x : y;\\n    }\\n\\n    function imax(int256 x, int256 y) internal pure returns (int256 z) {\\n        return x >= y ? x : y;\\n    }\\n\\n    uint256 constant WAD = 10**18;\\n    uint256 constant RAY = 10**27;\\n\\n    //rounds to zero if x*y < WAD / 2\\n    function wmul(uint256 x, uint256 y) internal pure returns (uint256 z) {\\n        z = add(mul(x, y), WAD / 2) / WAD;\\n    }\\n\\n    //rounds to zero if x*y < WAD / 2\\n    function rmul(uint256 x, uint256 y) internal pure returns (uint256 z) {\\n        z = add(mul(x, y), RAY / 2) / RAY;\\n    }\\n\\n    //rounds to zero if x*y < WAD / 2\\n    function wdiv(uint256 x, uint256 y) internal pure returns (uint256 z) {\\n        z = add(mul(x, WAD), y / 2) / y;\\n    }\\n\\n    //rounds to zero if x*y < RAY / 2\\n    function rdiv(uint256 x, uint256 y) internal pure returns (uint256 z) {\\n        z = add(mul(x, RAY), y / 2) / y;\\n    }\\n\\n    // This famous algorithm is called \\\"exponentiation by squaring\\\"\\n    // and calculates x^n with x as fixed-point and n as regular unsigned.\\n    //\\n    // It's O(log n), instead of O(n) for naive repeated multiplication.\\n    //\\n    // These facts are why it works:\\n    //\\n    //  If n is even, then x^n = (x^2)^(n/2).\\n    //  If n is odd,  then x^n = x * x^(n-1),\\n    //   and applying the equation for even x gives\\n    //    x^n = x * (x^2)^((n-1) / 2).\\n    //\\n    //  Also, EVM division is flooring and\\n    //    floor[(n-1) / 2] = floor[n / 2].\\n    //\\n    function rpow(uint256 x, uint256 n) internal pure returns (uint256 z) {\\n        z = n % 2 != 0 ? x : RAY;\\n\\n        for (n /= 2; n != 0; n /= 2) {\\n            x = rmul(x, x);\\n\\n            if (n % 2 != 0) {\\n                z = rmul(z, x);\\n            }\\n        }\\n    }\\n}\\n\",\"keccak256\":\"0xe1c6bb5cff7c83c85792349f61b3f4faf6e22bb02fa95d7af7b269e59a3902b2\",\"license\":\"MIT\"}},\"version\":1}",
  "bytecode": "0x613d0661003a600b82828239805160001a60731461002d57634e487b7160e01b600052600060045260246000fd5b30600052607381538281f3fe73000000000000000000000000000000000000000030146080604052600436106100be5760003560e01c8063c72733f71161007b578063c72733f71461017c578063cc918e7a14610191578063d8dfd0fe146101b1578063d9b87438146101d1578063de8e341814610211578063efc79c1a1461023157600080fd5b806307199524146100c35780630f7d679f146100f65780632904c239146101095780632e5fdf28146101295780634511ae6e1461013c57806358ffbb3d1461015c575b600080fd5b8180156100cf57600080fd5b506100e36100de36600461364c565b61027b565b6040519081526020015b60405180910390f35b6100e361010436600461359c565b610673565b81801561011557600080fd5b506100e3610124366004613478565b61068a565b6100e3610137366004613621565b610bf6565b81801561014857600080fd5b506100e361015736600461359c565b610c7a565b81801561016857600080fd5b506100e36101773660046133f6565b610d4c565b61018f61018a3660046134c8565b6112da565b005b81801561019d57600080fd5b506100e36101ac3660046135dc565b6116ac565b8180156101bd57600080fd5b506100e36101cc3660046133be565b611864565b6101e46101df3660046136de565b611c2b565b604080519687526020870195909552938501929092526060840152608083015260a082015260c0016100ed565b81801561021d57600080fd5b506100e361022c36600461342e565b611d42565b81801561023d57600080fd5b5061025161024c3660046136a3565b61203b565b604080516001600160a01b03909516855260208501939093529183015260608201526080016100ed565b60006001600160601b038411156102f05760405162461bcd60e51b815260206004820152602e60248201527f63757272656e744f746f6b656e5072656d69756d203e20747970652875696e7460448201526d393629206d61782076616c75652160901b60648201526084015b60405180910390fd5b600084116103385760405162461bcd60e51b81526020600482015260156024820152742163757272656e744f746f6b656e5072656d69756d60581b60448201526064016102e7565b6040516370a0823160e01b81523060048201526000906001600160a01b038716906370a082319060240160206040518083038186803b15801561037a57600080fd5b505afa15801561038e573d6000803e3d6000fd5b505050506040513d601f19601f820116820180604052508101906103b29190613876565b90506001600160801b0381111561041c5760405162461bcd60e51b815260206004820152602860248201527f6f546f6b656e42616c616e6365203e20747970652875696e7431323829206d61604482015267782076616c75652160c01b60648201526084016102e7565b604051636eb1769f60e11b81523060048201526001600160a01b0385811660248301526000919088169063dd62ed3e9060440160206040518083038186803b15801561046757600080fd5b505afa15801561047b573d6000803e3d6000fd5b505050506040513d601f19601f8201168201806040525081019061049f9190613876565b9050818110156104c8576104c8856104b7848461226a565b6001600160a01b038a169190612276565b8354610100900460ff1660006104df82600a613b58565b84116104f5576104f084600a612370565b610500565b61050082600a613b58565b90506001600160601b038111156105655760405162461bcd60e51b8152602060048201526024808201527f6d696e42696453697a65203e20747970652875696e74393629206d61782076616044820152636c75652160e01b60648201526084016102e7565b601282116105925761058d61057b60128461226a565b61058690600a613b58565b8990612370565b6105b2565b6105b26105a083601261226a565b6105ab90600a613b58565b899061237c565b86546040516307a975a160e01b81526001600160a01b038c8116600483015262010000909204821660248201526001600160601b038084166044830152841660648201526001600160801b03871660848201529199508816906307a975a19060a401602060405180830381600087803b15801561062e57600080fd5b505af1158015610642573d6000803e3d6000fd5b505050506040513d601f19601f820116820180604052508101906106669190613876565b9998505050505050505050565b6000610680848484612388565b90505b9392505050565b604051636553690d60e11b815230600482015260009085908290610715906001906001600160a01b0385169063caa6d21a9060240160206040518083038186803b1580156106d757600080fd5b505afa1580156106eb573d6000803e3d6000fd5b505050506040513d601f19601f8201168201806040525081019061070f9190613876565b90612644565b905060008590506000816001600160a01b031663aabaecd66040518163ffffffff1660e01b815260040160206040518083038186803b15801561075757600080fd5b505afa15801561076b573d6000803e3d6000fd5b505050506040513d601f19601f8201168201806040525081019061078f91906133da565b90506000816001600160a01b031663313ce5676040518163ffffffff1660e01b815260040160206040518083038186803b1580156107cc57600080fd5b505afa1580156107e0573d6000803e3d6000fd5b505050506040513d601f19601f8201168201806040525081019061080491906138d8565b60ff1690506000836001600160a01b031663f3c274a66040518163ffffffff1660e01b815260040160206040518083038186803b15801561084457600080fd5b505afa158015610858573d6000803e3d6000fd5b505050506040513d601f19601f8201168201806040525081019061087c9190613683565b156109435761093c61091461089284600a613ae9565b61089d90600a613b58565b866001600160a01b031663c52987cf6040518163ffffffff1660e01b815260040160206040518083038186803b1580156108d657600080fd5b505afa1580156108ea573d6000803e3d6000fd5b505050506040513d601f19601f8201168201806040525081019061090e9190613876565b9061237c565b610936670de0b6b3a764000061090e61092f6008600a613b58565b8d9061237c565b90612370565b905061097f565b5086600882111561097f57600061095b83600861226a565b61096690600a613b58565b90508082111561097d5761097a8982612370565b91505b505b826109946001600160a01b0382168c8b612650565b60408051600380825260808201909252600091816020015b6109b4613241565b8152602001906001900390816109ac579050506040805161010081019091529091508060008152602001306001600160a01b03168152602001306001600160a01b0316815260200160006001600160a01b0316815260200188815260200160008152602001600081526020016040518060200160405280600081525081525081600081518110610a5457634e487b7160e01b600052603260045260246000fd5b60209081029190910101526040805161010081019091528060058152602001306001600160a01b03168152602001306001600160a01b03168152602001866001600160a01b031681526020018881526020018b8152602001600081526020016040518060200160405280600081525081525081600181518110610ae757634e487b7160e01b600052603260045260246000fd5b60209081029190910101526040805161010081019091528060018152602001306001600160a01b03168152602001306001600160a01b031681526020018c6001600160a01b03168152602001888152602001848152602001600081526020016040518060200160405280600081525081525081600281518110610b7a57634e487b7160e01b600052603260045260246000fd5b6020908102919091010152604051635b0bf86360e11b81526001600160a01b0389169063b617f0c690610bb190849060040161397a565b600060405180830381600087803b158015610bcb57600080fd5b505af1158015610bdf573d6000803e3d6000fd5b50949a50505050505050505050505b949350505050565b6040516304f0f6bf60e31b8152600481018290526000906001600160a01b03841690632787b5f89060240160206040518083038186803b158015610c3957600080fd5b505afa158015610c4d573d6000803e3d6000fd5b505050506040513d601f19601f82011682018060405250810190610c719190613876565b90505b92915050565b600080610c878484610bf6565b905080610cc95760405162461bcd60e51b815260206004820152601060248201526f21736574746c656d656e74507269636560801b60448201526064016102e7565b6040516335053ced60e11b8152600481018290526001600160a01b03861690636a0a79da90602401602060405180830381600087803b158015610d0b57600080fd5b505af1158015610d1f573d6000803e3d6000fd5b505050506040513d601f19601f82011682018060405250810190610d439190613876565b95945050505050565b6040516370a0823160e01b815230600482015260009081906001600160a01b038416906370a082319060240160206040518083038186803b158015610d9057600080fd5b505afa158015610da4573d6000803e3d6000fd5b505050506040513d601f19601f82011682018060405250810190610dc89190613876565b905060008111610e0f5760405162461bcd60e51b815260206004820152601260248201527127379037aa37b5b2b739903a3790313ab93760711b60448201526064016102e7565b604051636553690d60e11b815230600482015284906000906001600160a01b0383169063caa6d21a9060240160206040518083038186803b158015610e5357600080fd5b505afa158015610e67573d6000803e3d6000fd5b505050506040513d601f19601f82011682018060405250810190610e8b9190613876565b60405163d99d13f560e01b8152306004820152602481018290529091506000906001600160a01b0384169063d99d13f59060440160006040518083038186803b158015610ed757600080fd5b505afa158015610eeb573d6000803e3d6000fd5b505050506040513d6000823e601f3d908101601f19168201604052610f139190810190613715565b805151909150610f505760405162461bcd60e51b8152602060048201526008602482015267139bc81cda1bdc9d60c21b60448201526064016102e7565b60008160400151600081518110610f7757634e487b7160e01b600052603260045260246000fd5b60209081029190910101516040516370a0823160e01b81523060048201529091506000906001600160a01b038316906370a082319060240160206040518083038186803b158015610fc757600080fd5b505afa158015610fdb573d6000803e3d6000fd5b505050506040513d601f19601f82011682018060405250810190610fff9190613876565b6040805160028082526060820190925291925060009190816020015b611023613241565b81526020019060019003908161101b579050506040805161010081019091529091508060028152306020820181905260408201528551805160609092019160009061107e57634e487b7160e01b600052603260045260246000fd5b60200260200101516001600160a01b031681526020018681526020018881526020016000815260200160405180602001604052806000815250815250816000815181106110db57634e487b7160e01b600052603260045260246000fd5b60209081029190910101526040805161010081019091528060068152602001306001600160a01b03168152602001306001600160a01b03168152602001846001600160a01b0316815260200186815260200161119c866060015160008151811061115557634e487b7160e01b600052603260045260246000fd5b60200260200101516109368b8960a0015160008151811061118657634e487b7160e01b600052603260045260246000fd5b602002602001015161237c90919063ffffffff16565b81526020016000815260200160405180602001604052806000815250815250816001815181106111dc57634e487b7160e01b600052603260045260246000fd5b6020908102919091010152604051635b0bf86360e11b81526001600160a01b0387169063b617f0c69061121390849060040161397a565b600060405180830381600087803b15801561122d57600080fd5b505af1158015611241573d6000803e3d6000fd5b50506040516370a0823160e01b8152306004820152600092506001600160a01b03861691506370a082319060240160206040518083038186803b15801561128757600080fd5b505afa15801561129b573d6000803e3d6000fd5b505050506040513d601f19601f820116820180604052508101906112bf9190613876565b90506112cb818461226a565b9b9a5050505050505050505050565b6001600160a01b038a166113195760405162461bcd60e51b815260206004820152600660248201526510b7bbb732b960d11b60448201526064016102e7565b6001600160a01b0389166113595760405162461bcd60e51b815260206004820152600760248201526610b5b2b2b832b960c91b60448201526064016102e7565b6001600160a01b03881661139f5760405162461bcd60e51b815260206004820152600d60248201526c08599959549958da5c1a595b9d609a1b60448201526064016102e7565b6113ad620f42406064613c00565b87106113f45760405162461bcd60e51b8152602060048201526016602482015275706572666f726d616e6365466565203e3d203130302560501b60448201526064016102e7565b611402620f42406064613c00565b86106114485760405162461bcd60e51b81526020600482015260156024820152746d616e6167656d656e74466565203e3d203130302560581b60448201526064016102e7565b836114825760405162461bcd60e51b815260206004820152600a60248201526921746f6b656e4e616d6560b01b60448201526064016102e7565b816114be5760405162461bcd60e51b815260206004820152600c60248201526b085d1bdad95b94de5b589bdb60a21b60448201526064016102e7565b60006114d060608301604084016133be565b6001600160a01b031614156115105760405162461bcd60e51b815260206004820152600660248201526508585cdcd95d60d21b60448201526064016102e7565b600061152260808301606084016133be565b6001600160a01b031614156115675760405162461bcd60e51b815260206004820152600b60248201526a21756e6465726c79696e6760a81b60448201526064016102e7565b600061157960a08301608084016138b1565b66ffffffffffffff16116115c05760405162461bcd60e51b815260206004820152600e60248201526d216d696e696d756d537570706c7960901b60448201526064016102e7565b60006115d260c0830160a0840161382d565b6001600160681b0316116116115760405162461bcd60e51b81526004016102e7906020808252600490820152630216361760e41b604082015260600190565b61162160a08201608083016138b1565b66ffffffffffffff1661163a60c0830160a0840161382d565b6001600160681b0316116116a05760405162461bcd60e51b815260206004820152602760248201527f6361702068617320746f20626520686967686572207468616e206d696e696d756044820152666d537570706c7960c81b60648201526084016102e7565b50505050505050505050565b60006001600160a01b03851615610bee576116d56116cb606480613c00565b610936858561237c565b6040516308997b9760e01b8152306004820152602481018290529091506001600160a01b038616906308997b979060440160206040518083038186803b15801561171e57600080fd5b505afa158015611732573d6000803e3d6000fd5b505050506040513d601f19601f820116820180604052508101906117569190613876565b90508015610bee5760405163095ea7b360e01b81526001600160a01b0386811660048301526024820183905285169063095ea7b390604401602060405180830381600087803b1580156117a857600080fd5b505af11580156117bc573d6000803e3d6000fd5b505050506040513d601f19601f820116820180604052508101906117e09190613683565b50604051637c3e116b60e01b8152600481018290526001600160a01b03861690637c3e116b90602401602060405180830381600087803b15801561182357600080fd5b505af1158015611837573d6000803e3d6000fd5b505050506040513d601f19601f8201168201806040525081019061185b9190613876565b50949350505050565b604051636553690d60e11b8152306004820152600090829082906001600160a01b0383169063caa6d21a9060240160206040518083038186803b1580156118aa57600080fd5b505afa1580156118be573d6000803e3d6000fd5b505050506040513d601f19601f820116820180604052508101906118e29190613876565b60405163d99d13f560e01b8152306004820152602481018290529091506000906001600160a01b0384169063d99d13f59060440160006040518083038186803b15801561192e57600080fd5b505afa158015611942573d6000803e3d6000fd5b505050506040513d6000823e601f3d908101601f1916820160405261196a9190810190613715565b8051519091506119a75760405162461bcd60e51b8152602060048201526008602482015267139bc81cda1bdc9d60c21b60448201526064016102e7565b600081604001516000815181106119ce57634e487b7160e01b600052603260045260246000fd5b6020026020010151905060006001600160a01b0316816001600160a01b031614156119ff5750600095945050505050565b6040516370a0823160e01b81523060048201526000906001600160a01b038316906370a082319060240160206040518083038186803b158015611a4157600080fd5b505afa158015611a55573d6000803e3d6000fd5b505050506040513d601f19601f82011682018060405250810190611a799190613876565b60408051600180825281830190925291925060009190816020015b611a9c613241565b815260200190600190039081611a94579050506040805161010081019091529091508060078152602001306001600160a01b03168152602001306001600160a01b0316815260200160006001600160a01b0316815260200186815260200160008152602001600081526020016040518060200160405280600081525081525081600081518110611b3c57634e487b7160e01b600052603260045260246000fd5b6020908102919091010152604051635b0bf86360e11b81526001600160a01b0387169063b617f0c690611b7390849060040161397a565b600060405180830381600087803b158015611b8d57600080fd5b505af1158015611ba1573d6000803e3d6000fd5b50506040516370a0823160e01b8152306004820152600092506001600160a01b03861691506370a082319060240160206040518083038186803b158015611be757600080fd5b505afa158015611bfb573d6000803e3d6000fd5b505050506040513d601f19601f82011682018060405250810190611c1f9190613876565b9050610666818461226a565b6001820154600090819081908190819081906020880135906001600160801b0380821691600160801b90041683611c668460608d013561226a565b9050611cbd818d600001600f9054906101000a90046001600160681b03166001600160681b03168e60010160009054906101000a90046001600160801b03166001600160801b03168e608001358f60a00135612691565b919750909550611ccf9050848661226a565b9350611cf8611ce260408d01358461226a565b611cf08660608f013561226a565b858e35612742565b9750611d18611d0d60c08d01358a8e35612778565b60608d013590612644565b9850611d2683898d356127da565b9650611d32848a61226a565b9950505050509295509295509295565b6040516370a0823160e01b8152306004820152600090849082906001600160a01b038616906370a082319060240160206040518083038186803b158015611d8857600080fd5b505afa158015611d9c573d6000803e3d6000fd5b505050506040513d601f19601f82011682018060405250810190611dc09190613876565b60405163565eea1960e01b81526001600160a01b038781166004830152602482018390529192509083169063565eea199060440160206040518083038186803b158015611e0c57600080fd5b505afa158015611e20573d6000803e3d6000fd5b505050506040513d601f19601f82011682018060405250810190611e449190613876565b611e5357600092505050610683565b6040516370a0823160e01b81523060048201526000906001600160a01b038616906370a082319060240160206040518083038186803b158015611e9557600080fd5b505afa158015611ea9573d6000803e3d6000fd5b505050506040513d601f19601f82011682018060405250810190611ecd9190613876565b60408051600180825281830190925291925060009190816020015b611ef0613241565b815260200190600190039081611ee857905050604080516101008101909152909150806008815260200160006001600160a01b03168152602001306001600160a01b03168152602001886001600160a01b0316815260200160008152602001848152602001600081526020016040518060200160405280600081525081525081600081518110611f9057634e487b7160e01b600052603260045260246000fd5b6020908102919091010152604051635b0bf86360e11b81526001600160a01b0385169063b617f0c690611fc790849060040161397a565b600060405180830381600087803b158015611fe157600080fd5b505af1158015611ff5573d6000803e3d6000fd5b50506040516370a0823160e01b8152306004820152600092506001600160a01b03891691506370a082319060240160206040518083038186803b158015611be757600080fd5b60008080808061205961205460608a0160408b016133be565b61283d565b9050600061206d60e08a0160c08b016133be565b885460018a0154895492935060ff8216926001600160a01b03918216926201000090049091169061ffff166120a860a08e0160808f01613854565b61ffff16146121355760405163e436b89160e01b81526004810186905283151560248201526001600160a01b0385169063e436b89190604401604080518083038186803b1580156120f857600080fd5b505afa15801561210c573d6000803e3d6000fd5b505050506040513d601f19601f82011682018060405250810190612130919061388e565b6121ab565b8b60a00135846001600160a01b03166312b495a86040518163ffffffff1660e01b815260040160206040518083038186803b15801561217357600080fd5b505afa158015612187573d6000803e3d6000fd5b505050506040513d601f19601f820116820180604052508101906121ab9190613876565b9097509550866121ec5760405162461bcd60e51b815260206004820152600c60248201526b21737472696b65507269636560a01b60448201526064016102e7565b6121fb8c8c84848b8a896128f1565b985061221f898d60e001602081019061221491906133be565b8e6101000135612388565b97506000881161225c5760405162461bcd60e51b8152602060048201526008602482015267217072656d69756d60c01b60448201526064016102e7565b505050505093509350935093565b6000610c718284613c1f565b604051636eb1769f60e11b81523060048201526001600160a01b038381166024830152600091839186169063dd62ed3e9060440160206040518083038186803b1580156122c257600080fd5b505afa1580156122d6573d6000803e3d6000fd5b505050506040513d601f19601f820116820180604052508101906122fa9190613876565b6123049190613ae9565b6040516001600160a01b03851660248201526044810182905290915061236a90859063095ea7b360e01b906064015b60408051601f198184030181529190526020810180516001600160e01b03166001600160e01b031990931692909217909152612a85565b50505050565b6000610c718284613b01565b6000610c718284613c00565b60008084905060008490506000816001600160a01b031663fc3d42e8846001600160a01b031663c52987cf6040518163ffffffff1660e01b815260040160206040518083038186803b1580156123dd57600080fd5b505afa1580156123f1573d6000803e3d6000fd5b505050506040513d601f19601f820116820180604052508101906124159190613876565b856001600160a01b031663ade6e2aa6040518163ffffffff1660e01b815260040160206040518083038186803b15801561244e57600080fd5b505afa158015612462573d6000803e3d6000fd5b505050506040513d601f19601f820116820180604052508101906124869190613876565b866001600160a01b031663f3c274a66040518163ffffffff1660e01b815260040160206040518083038186803b1580156124bf57600080fd5b505afa1580156124d3573d6000803e3d6000fd5b505050506040513d601f19601f820116820180604052508101906124f79190613683565b6040516001600160e01b031960e086901b168152600481019390935260248301919091521515604482015260640160206040518083038186803b15801561253d57600080fd5b505afa158015612551573d6000803e3d6000fd5b505050506040513d601f19601f820116820180604052508101906125759190613876565b9050612590612586600a6064613c00565b610936838861237c565b90506001600160601b038111156125f95760405162461bcd60e51b815260206004820152602760248201527f6f7074696f6e5072656d69756d203e20747970652875696e74393629206d61786044820152662076616c75652160c81b60648201526084016102e7565b6000811161263a5760405162461bcd60e51b815260206004820152600e60248201526d216f7074696f6e5072656d69756d60901b60448201526064016102e7565b9695505050505050565b6000610c718284613ae9565b6001600160a01b03831673dac17f958d2ee523a2206206994597c13d831ec714156126815761268183836000612b57565b61268c838383612b57565b505050565b6000806000808689116126a55760006126af565b6126af898861226a565b905060008060008a84111561273057600089116126cd5760006126f5565b6126f56126de620f42406064613c00565b6109368b61090e8f8961226a90919063ffffffff16565b925060008811612706576000612721565b612721612717620f42406064613c00565b610936868b61237c565b915061272d8383612644565b90505b919b909a509098509650505050505050565b60008061275083600a613b58565b905060008611612760578061263a565b61263a86610936612771888861226a565b849061237c565b6000600183116127c25760405162461bcd60e51b8152602060048201526015602482015274496e76616c6964206173736574506572536861726560581b60448201526064016102e7565b6106806127d083600a613b58565b610936868661237c565b6000600183116128245760405162461bcd60e51b8152602060048201526015602482015274496e76616c6964206173736574506572536861726560581b60448201526064016102e7565b6106808361093661283685600a613b58565b879061237c565b60006001600160a01b03821661285657610c7442612c7b565b6000826001600160a01b031663ade6e2aa6040518163ffffffff1660e01b815260040160206040518083038186803b15801561289157600080fd5b505afa1580156128a5573d6000803e3d6000fd5b505050506040513d601f19601f820116820180604052508101906128c99190613876565b90506128d88162093a80613ae9565b4211156128e85761068342612c7b565b61068381612c7b565b60008061290160208a018a6133be565b905060006001600160a01b03821663115470548961292560408e0160208f016133be565b8a8a8a8a6040518763ffffffff1660e01b815260040161294a96959493929190613941565b60206040518083038186803b15801561296257600080fd5b505afa158015612976573d6000803e3d6000fd5b505050506040513d601f19601f8201168201806040525081019061299a91906133da565b90506001600160a01b038116156129b4579150612a7a9050565b6000826001600160a01b031663c09746308a8d60200160208101906129d991906133be565b8b8b8b8b6040518763ffffffff1660e01b81526004016129fe96959493929190613941565b602060405180830381600087803b158015612a1857600080fd5b505af1158015612a2c573d6000803e3d6000fd5b505050506040513d601f19601f82011682018060405250810190612a5091906133da565b9050612a75818b8a8e6020016020810190612a6b91906133be565b8f60600135612d11565b925050505b979650505050505050565b6000612ada826040518060400160405280602081526020017f5361666545524332303a206c6f772d6c6576656c2063616c6c206661696c6564815250856001600160a01b03166131469092919063ffffffff16565b80519091501561268c5780806020019051810190612af89190613683565b61268c5760405162461bcd60e51b815260206004820152602a60248201527f5361666545524332303a204552433230206f7065726174696f6e20646964206e6044820152691bdd081cdd58d8d9595960b21b60648201526084016102e7565b801580612be05750604051636eb1769f60e11b81523060048201526001600160a01b03838116602483015284169063dd62ed3e9060440160206040518083038186803b158015612ba657600080fd5b505afa158015612bba573d6000803e3d6000fd5b505050506040513d601f19601f82011682018060405250810190612bde9190613876565b155b612c4b5760405162461bcd60e51b815260206004820152603660248201527f5361666545524332303a20617070726f76652066726f6d206e6f6e2d7a65726f60448201527520746f206e6f6e2d7a65726f20616c6c6f77616e636560501b60648201526084016102e7565b6040516001600160a01b03831660248201526044810182905261268c90849063095ea7b360e01b90606401612333565b6000806007612c8d6201518085613b01565b612c98906004613ae9565b612ca29190613c62565b905060006007612cb383600c613c1f565b612cbd9190613c62565b612cca9062015180613c00565b612cd49085613ae9565b90506000612ce56201518083613c62565b612cef9083613c1f565b612cfb90617080613ae9565b9050808510610bee57610d4362093a8082613ae9565b6001600160a01b038516612d585760405162461bcd60e51b815260206004820152600e60248201526d216f746f6b656e4164647265737360901b60448201526064016102e7565b8354604080516379e13a5360e11b81529051879260ff161515916001600160a01b0384169163f3c274a691600480820192602092909190829003018186803b158015612da357600080fd5b505afa158015612db7573d6000803e3d6000fd5b505050506040513d601f19601f82011682018060405250810190612ddb9190613683565b151514612e1a5760405162461bcd60e51b815260206004820152600d60248201526c0a8f2e0ca40dad2e6dac2e8c6d609b1b60448201526064016102e7565b600185015460408051631c56369f60e21b815290516001600160a01b0392831692841691637158da7c916004808301926020929190829003018186803b158015612e6357600080fd5b505afa158015612e77573d6000803e3d6000fd5b505050506040513d601f19601f82011682018060405250810190612e9b91906133da565b6001600160a01b031614612ee95760405162461bcd60e51b815260206004820152601560248201527415dc9bdb99c81d5b99195c9b1e5a5b99d05cdcd95d605a1b60448201526064016102e7565b836001600160a01b0316816001600160a01b031663aabaecd66040518163ffffffff1660e01b815260040160206040518083038186803b158015612f2c57600080fd5b505afa158015612f40573d6000803e3d6000fd5b505050506040513d601f19601f82011682018060405250810190612f6491906133da565b6001600160a01b031614612fb25760405162461bcd60e51b815260206004820152601560248201527415dc9bdb99c818dbdb1b185d195c985b105cdcd95d605a1b60448201526064016102e7565b826001600160a01b0316816001600160a01b03166317d69bc86040518163ffffffff1660e01b815260040160206040518083038186803b158015612ff557600080fd5b505afa158015613009573d6000803e3d6000fd5b505050506040513d601f19601f8201168201806040525081019061302d91906133da565b6001600160a01b0316146130795760405162461bcd60e51b8152602060048201526013602482015272737472696b65417373657420213d205553444360681b60448201526064016102e7565b60006130854284612644565b905080826001600160a01b031663ade6e2aa6040518163ffffffff1660e01b815260040160206040518083038186803b1580156130c157600080fd5b505afa1580156130d5573d6000803e3d6000fd5b505050506040513d601f19601f820116820180604052508101906130f99190613876565b101561313d5760405162461bcd60e51b8152602060048201526013602482015272457870697279206265666f72652064656c617960681b60448201526064016102e7565b50505050505050565b6060610680848460008585843b61319f5760405162461bcd60e51b815260206004820152601d60248201527f416464726573733a2063616c6c20746f206e6f6e2d636f6e747261637400000060448201526064016102e7565b600080866001600160a01b031685876040516131bb9190613925565b60006040518083038185875af1925050503d80600081146131f8576040519150601f19603f3d011682016040523d82523d6000602084013e6131fd565b606091505b5091509150612a7a82828660608315613217575081610683565b8251156132275782518084602001fd5b8160405162461bcd60e51b81526004016102e79190613a58565b604080516101008101909152806000815260200160006001600160a01b0316815260200160006001600160a01b0316815260200160006001600160a01b03168152602001600081526020016000815260200160008152602001606081525090565b600082601f8301126132b2578081fd5b815160206132c76132c283613ac5565b613a94565b80838252828201915082860187848660051b89010111156132e6578586fd5b855b8581101561330d5781516132fb81613cb8565b845292840192908401906001016132e8565b5090979650505050505050565b600082601f83011261332a578081fd5b8151602061333a6132c283613ac5565b80838252828201915082860187848660051b8901011115613359578586fd5b855b8581101561330d5781518452928401929084019060010161335b565b60008083601f840112613388578182fd5b50813567ffffffffffffffff81111561339f578182fd5b6020830191508360208285010111156133b757600080fd5b9250929050565b6000602082840312156133cf578081fd5b813561068381613cb8565b6000602082840312156133eb578081fd5b815161068381613cb8565b60008060408385031215613408578081fd5b823561341381613cb8565b9150602083013561342381613cb8565b809150509250929050565b600080600060608486031215613442578081fd5b833561344d81613cb8565b9250602084013561345d81613cb8565b9150604084013561346d81613cb8565b809150509250925092565b6000806000806080858703121561348d578081fd5b843561349881613cb8565b935060208501356134a881613cb8565b925060408501356134b881613cb8565b9396929550929360600135925050565b6000806000806000806000806000806101a08b8d0312156134e7578788fd5b6134f18b35613cb8565b8a35995060208b013561350381613cb8565b985060408b013561351381613cb8565b975060608b0135965060808b0135955060a08b013567ffffffffffffffff8082111561353d578687fd5b6135498e838f01613377565b909750955060c08d0135915080821115613561578485fd5b5061356e8d828e01613377565b90945092505060c08b8d0360df19011215613587578081fd5b60e08b0190509295989b9194979a5092959850565b6000806000606084860312156135b0578081fd5b83356135bb81613cb8565b925060208401356135cb81613cb8565b929592945050506040919091013590565b600080600080608085870312156135f1578182fd5b84356135fc81613cb8565b9350602085013561360c81613cb8565b93969395505050506040820135916060013590565b60008060408385031215613633578182fd5b823561363e81613cb8565b946020939093013593505050565b60008060008060808587031215613661578182fd5b843561366c81613cb8565b93506020850135925060408501356134b881613cb8565b600060208284031215613694578081fd5b81518015158114610683578182fd5b60008060008385036101608112156136b9578182fd5b610120808212156136c8578283fd5b9496948701359550505061014085013592915050565b6000808284036101008112156136f2578283fd5b8335925060e0601f1982011215613707578182fd5b506020830190509250929050565b600060208284031215613726578081fd5b815167ffffffffffffffff8082111561373d578283fd5b9083019060c08286031215613750578283fd5b613758613a6b565b825182811115613766578485fd5b613772878286016132a2565b825250602083015182811115613786578485fd5b613792878286016132a2565b6020830152506040830151828111156137a9578485fd5b6137b5878286016132a2565b6040830152506060830151828111156137cc578485fd5b6137d88782860161331a565b6060830152506080830151828111156137ef578485fd5b6137fb8782860161331a565b60808301525060a083015182811115613812578485fd5b61381e8782860161331a565b60a08301525095945050505050565b60006020828403121561383e578081fd5b81356001600160681b0381168114610683578182fd5b600060208284031215613865578081fd5b813561ffff81168114610683578182fd5b600060208284031215613887578081fd5b5051919050565b600080604083850312156138a0578182fd5b505080516020909101519092909150565b6000602082840312156138c2578081fd5b813566ffffffffffffff81168114610683578182fd5b6000602082840312156138e9578081fd5b815160ff81168114610683578182fd5b60008151808452613911816020860160208601613c36565b601f01601f19169290920160200192915050565b60008251613937818460208701613c36565b9190910192915050565b6001600160a01b03968716815294861660208601529290941660408401526060830152608082019290925290151560a082015260c00190565b60006020808301818452808551808352604092508286019150828160051b870101848801865b83811015613a4a57603f1989840301855281516101008151600b81106139d457634e487b7160e01b8b52602160045260248bfd5b8552818901516001600160a01b039081168a87015288830151811689870152606080840151909116908601526080808301519086015260a0808301519086015260c0808301519086015260e091820151918501819052613a36818601836138f9565b9689019694505050908601906001016139a0565b509098975050505050505050565b602081526000610c7160208301846138f9565b60405160c0810167ffffffffffffffff81118282101715613a8e57613a8e613ca2565b60405290565b604051601f8201601f1916810167ffffffffffffffff81118282101715613abd57613abd613ca2565b604052919050565b600067ffffffffffffffff821115613adf57613adf613ca2565b5060051b60200190565b60008219821115613afc57613afc613c76565b500190565b600082613b1057613b10613c8c565b500490565b600181815b80851115613b50578160001904821115613b3657613b36613c76565b80851615613b4357918102915b93841c9390800290613b1a565b509250929050565b6000610c718383600082613b6e57506001610c74565b81613b7b57506000610c74565b8160018114613b915760028114613b9b57613bb7565b6001915050610c74565b60ff841115613bac57613bac613c76565b50506001821b610c74565b5060208310610133831016604e8410600b8410161715613bda575081810a610c74565b613be48383613b15565b8060001904821115613bf857613bf8613c76565b029392505050565b6000816000190483118215151615613c1a57613c1a613c76565b500290565b600082821015613c3157613c31613c76565b500390565b60005b83811015613c51578181015183820152602001613c39565b8381111561236a5750506000910152565b600082613c7157613c71613c8c565b500690565b634e487b7160e01b600052601160045260246000fd5b634e487b7160e01b600052601260045260246000fd5b634e487b7160e01b600052604160045260246000fd5b6001600160a01b0381168114613ccd57600080fd5b5056fea2646970667358221220251f12ab01ae711787a1a23ea33afc1256c509ed5aacbf300cc497ceddf30f9864736f6c63430008040033",
  "deployedBytecode": "0x73000000000000000000000000000000000000000030146080604052600436106100be5760003560e01c8063c72733f71161007b578063c72733f71461017c578063cc918e7a14610191578063d8dfd0fe146101b1578063d9b87438146101d1578063de8e341814610211578063efc79c1a1461023157600080fd5b806307199524146100c35780630f7d679f146100f65780632904c239146101095780632e5fdf28146101295780634511ae6e1461013c57806358ffbb3d1461015c575b600080fd5b8180156100cf57600080fd5b506100e36100de36600461364c565b61027b565b6040519081526020015b60405180910390f35b6100e361010436600461359c565b610673565b81801561011557600080fd5b506100e3610124366004613478565b61068a565b6100e3610137366004613621565b610bf6565b81801561014857600080fd5b506100e361015736600461359c565b610c7a565b81801561016857600080fd5b506100e36101773660046133f6565b610d4c565b61018f61018a3660046134c8565b6112da565b005b81801561019d57600080fd5b506100e36101ac3660046135dc565b6116ac565b8180156101bd57600080fd5b506100e36101cc3660046133be565b611864565b6101e46101df3660046136de565b611c2b565b604080519687526020870195909552938501929092526060840152608083015260a082015260c0016100ed565b81801561021d57600080fd5b506100e361022c36600461342e565b611d42565b81801561023d57600080fd5b5061025161024c3660046136a3565b61203b565b604080516001600160a01b03909516855260208501939093529183015260608201526080016100ed565b60006001600160601b038411156102f05760405162461bcd60e51b815260206004820152602e60248201527f63757272656e744f746f6b656e5072656d69756d203e20747970652875696e7460448201526d393629206d61782076616c75652160901b60648201526084015b60405180910390fd5b600084116103385760405162461bcd60e51b81526020600482015260156024820152742163757272656e744f746f6b656e5072656d69756d60581b60448201526064016102e7565b6040516370a0823160e01b81523060048201526000906001600160a01b038716906370a082319060240160206040518083038186803b15801561037a57600080fd5b505afa15801561038e573d6000803e3d6000fd5b505050506040513d601f19601f820116820180604052508101906103b29190613876565b90506001600160801b0381111561041c5760405162461bcd60e51b815260206004820152602860248201527f6f546f6b656e42616c616e6365203e20747970652875696e7431323829206d61604482015267782076616c75652160c01b60648201526084016102e7565b604051636eb1769f60e11b81523060048201526001600160a01b0385811660248301526000919088169063dd62ed3e9060440160206040518083038186803b15801561046757600080fd5b505afa15801561047b573d6000803e3d6000fd5b505050506040513d601f19601f8201168201806040525081019061049f9190613876565b9050818110156104c8576104c8856104b7848461226a565b6001600160a01b038a169190612276565b8354610100900460ff1660006104df82600a613b58565b84116104f5576104f084600a612370565b610500565b61050082600a613b58565b90506001600160601b038111156105655760405162461bcd60e51b8152602060048201526024808201527f6d696e42696453697a65203e20747970652875696e74393629206d61782076616044820152636c75652160e01b60648201526084016102e7565b601282116105925761058d61057b60128461226a565b61058690600a613b58565b8990612370565b6105b2565b6105b26105a083601261226a565b6105ab90600a613b58565b899061237c565b86546040516307a975a160e01b81526001600160a01b038c8116600483015262010000909204821660248201526001600160601b038084166044830152841660648201526001600160801b03871660848201529199508816906307a975a19060a401602060405180830381600087803b15801561062e57600080fd5b505af1158015610642573d6000803e3d6000fd5b505050506040513d601f19601f820116820180604052508101906106669190613876565b9998505050505050505050565b6000610680848484612388565b90505b9392505050565b604051636553690d60e11b815230600482015260009085908290610715906001906001600160a01b0385169063caa6d21a9060240160206040518083038186803b1580156106d757600080fd5b505afa1580156106eb573d6000803e3d6000fd5b505050506040513d601f19601f8201168201806040525081019061070f9190613876565b90612644565b905060008590506000816001600160a01b031663aabaecd66040518163ffffffff1660e01b815260040160206040518083038186803b15801561075757600080fd5b505afa15801561076b573d6000803e3d6000fd5b505050506040513d601f19601f8201168201806040525081019061078f91906133da565b90506000816001600160a01b031663313ce5676040518163ffffffff1660e01b815260040160206040518083038186803b1580156107cc57600080fd5b505afa1580156107e0573d6000803e3d6000fd5b505050506040513d601f19601f8201168201806040525081019061080491906138d8565b60ff1690506000836001600160a01b031663f3c274a66040518163ffffffff1660e01b815260040160206040518083038186803b15801561084457600080fd5b505afa158015610858573d6000803e3d6000fd5b505050506040513d601f19601f8201168201806040525081019061087c9190613683565b156109435761093c61091461089284600a613ae9565b61089d90600a613b58565b866001600160a01b031663c52987cf6040518163ffffffff1660e01b815260040160206040518083038186803b1580156108d657600080fd5b505afa1580156108ea573d6000803e3d6000fd5b505050506040513d601f19601f8201168201806040525081019061090e9190613876565b9061237c565b610936670de0b6b3a764000061090e61092f6008600a613b58565b8d9061237c565b90612370565b905061097f565b5086600882111561097f57600061095b83600861226a565b61096690600a613b58565b90508082111561097d5761097a8982612370565b91505b505b826109946001600160a01b0382168c8b612650565b60408051600380825260808201909252600091816020015b6109b4613241565b8152602001906001900390816109ac579050506040805161010081019091529091508060008152602001306001600160a01b03168152602001306001600160a01b0316815260200160006001600160a01b0316815260200188815260200160008152602001600081526020016040518060200160405280600081525081525081600081518110610a5457634e487b7160e01b600052603260045260246000fd5b60209081029190910101526040805161010081019091528060058152602001306001600160a01b03168152602001306001600160a01b03168152602001866001600160a01b031681526020018881526020018b8152602001600081526020016040518060200160405280600081525081525081600181518110610ae757634e487b7160e01b600052603260045260246000fd5b60209081029190910101526040805161010081019091528060018152602001306001600160a01b03168152602001306001600160a01b031681526020018c6001600160a01b03168152602001888152602001848152602001600081526020016040518060200160405280600081525081525081600281518110610b7a57634e487b7160e01b600052603260045260246000fd5b6020908102919091010152604051635b0bf86360e11b81526001600160a01b0389169063b617f0c690610bb190849060040161397a565b600060405180830381600087803b158015610bcb57600080fd5b505af1158015610bdf573d6000803e3d6000fd5b50949a50505050505050505050505b949350505050565b6040516304f0f6bf60e31b8152600481018290526000906001600160a01b03841690632787b5f89060240160206040518083038186803b158015610c3957600080fd5b505afa158015610c4d573d6000803e3d6000fd5b505050506040513d601f19601f82011682018060405250810190610c719190613876565b90505b92915050565b600080610c878484610bf6565b905080610cc95760405162461bcd60e51b815260206004820152601060248201526f21736574746c656d656e74507269636560801b60448201526064016102e7565b6040516335053ced60e11b8152600481018290526001600160a01b03861690636a0a79da90602401602060405180830381600087803b158015610d0b57600080fd5b505af1158015610d1f573d6000803e3d6000fd5b505050506040513d601f19601f82011682018060405250810190610d439190613876565b95945050505050565b6040516370a0823160e01b815230600482015260009081906001600160a01b038416906370a082319060240160206040518083038186803b158015610d9057600080fd5b505afa158015610da4573d6000803e3d6000fd5b505050506040513d601f19601f82011682018060405250810190610dc89190613876565b905060008111610e0f5760405162461bcd60e51b815260206004820152601260248201527127379037aa37b5b2b739903a3790313ab93760711b60448201526064016102e7565b604051636553690d60e11b815230600482015284906000906001600160a01b0383169063caa6d21a9060240160206040518083038186803b158015610e5357600080fd5b505afa158015610e67573d6000803e3d6000fd5b505050506040513d601f19601f82011682018060405250810190610e8b9190613876565b60405163d99d13f560e01b8152306004820152602481018290529091506000906001600160a01b0384169063d99d13f59060440160006040518083038186803b158015610ed757600080fd5b505afa158015610eeb573d6000803e3d6000fd5b505050506040513d6000823e601f3d908101601f19168201604052610f139190810190613715565b805151909150610f505760405162461bcd60e51b8152602060048201526008602482015267139bc81cda1bdc9d60c21b60448201526064016102e7565b60008160400151600081518110610f7757634e487b7160e01b600052603260045260246000fd5b60209081029190910101516040516370a0823160e01b81523060048201529091506000906001600160a01b038316906370a082319060240160206040518083038186803b158015610fc757600080fd5b505afa158015610fdb573d6000803e3d6000fd5b505050506040513d601f19601f82011682018060405250810190610fff9190613876565b6040805160028082526060820190925291925060009190816020015b611023613241565b81526020019060019003908161101b579050506040805161010081019091529091508060028152306020820181905260408201528551805160609092019160009061107e57634e487b7160e01b600052603260045260246000fd5b60200260200101516001600160a01b031681526020018681526020018881526020016000815260200160405180602001604052806000815250815250816000815181106110db57634e487b7160e01b600052603260045260246000fd5b60209081029190910101526040805161010081019091528060068152602001306001600160a01b03168152602001306001600160a01b03168152602001846001600160a01b0316815260200186815260200161119c866060015160008151811061115557634e487b7160e01b600052603260045260246000fd5b60200260200101516109368b8960a0015160008151811061118657634e487b7160e01b600052603260045260246000fd5b602002602001015161237c90919063ffffffff16565b81526020016000815260200160405180602001604052806000815250815250816001815181106111dc57634e487b7160e01b600052603260045260246000fd5b6020908102919091010152604051635b0bf86360e11b81526001600160a01b0387169063b617f0c69061121390849060040161397a565b600060405180830381600087803b15801561122d57600080fd5b505af1158015611241573d6000803e3d6000fd5b50506040516370a0823160e01b8152306004820152600092506001600160a01b03861691506370a082319060240160206040518083038186803b15801561128757600080fd5b505afa15801561129b573d6000803e3d6000fd5b505050506040513d601f19601f820116820180604052508101906112bf9190613876565b90506112cb818461226a565b9b9a5050505050505050505050565b6001600160a01b038a166113195760405162461bcd60e51b815260206004820152600660248201526510b7bbb732b960d11b60448201526064016102e7565b6001600160a01b0389166113595760405162461bcd60e51b815260206004820152600760248201526610b5b2b2b832b960c91b60448201526064016102e7565b6001600160a01b03881661139f5760405162461bcd60e51b815260206004820152600d60248201526c08599959549958da5c1a595b9d609a1b60448201526064016102e7565b6113ad620f42406064613c00565b87106113f45760405162461bcd60e51b8152602060048201526016602482015275706572666f726d616e6365466565203e3d203130302560501b60448201526064016102e7565b611402620f42406064613c00565b86106114485760405162461bcd60e51b81526020600482015260156024820152746d616e6167656d656e74466565203e3d203130302560581b60448201526064016102e7565b836114825760405162461bcd60e51b815260206004820152600a60248201526921746f6b656e4e616d6560b01b60448201526064016102e7565b816114be5760405162461bcd60e51b815260206004820152600c60248201526b085d1bdad95b94de5b589bdb60a21b60448201526064016102e7565b60006114d060608301604084016133be565b6001600160a01b031614156115105760405162461bcd60e51b815260206004820152600660248201526508585cdcd95d60d21b60448201526064016102e7565b600061152260808301606084016133be565b6001600160a01b031614156115675760405162461bcd60e51b815260206004820152600b60248201526a21756e6465726c79696e6760a81b60448201526064016102e7565b600061157960a08301608084016138b1565b66ffffffffffffff16116115c05760405162461bcd60e51b815260206004820152600e60248201526d216d696e696d756d537570706c7960901b60448201526064016102e7565b60006115d260c0830160a0840161382d565b6001600160681b0316116116115760405162461bcd60e51b81526004016102e7906020808252600490820152630216361760e41b604082015260600190565b61162160a08201608083016138b1565b66ffffffffffffff1661163a60c0830160a0840161382d565b6001600160681b0316116116a05760405162461bcd60e51b815260206004820152602760248201527f6361702068617320746f20626520686967686572207468616e206d696e696d756044820152666d537570706c7960c81b60648201526084016102e7565b50505050505050505050565b60006001600160a01b03851615610bee576116d56116cb606480613c00565b610936858561237c565b6040516308997b9760e01b8152306004820152602481018290529091506001600160a01b038616906308997b979060440160206040518083038186803b15801561171e57600080fd5b505afa158015611732573d6000803e3d6000fd5b505050506040513d601f19601f820116820180604052508101906117569190613876565b90508015610bee5760405163095ea7b360e01b81526001600160a01b0386811660048301526024820183905285169063095ea7b390604401602060405180830381600087803b1580156117a857600080fd5b505af11580156117bc573d6000803e3d6000fd5b505050506040513d601f19601f820116820180604052508101906117e09190613683565b50604051637c3e116b60e01b8152600481018290526001600160a01b03861690637c3e116b90602401602060405180830381600087803b15801561182357600080fd5b505af1158015611837573d6000803e3d6000fd5b505050506040513d601f19601f8201168201806040525081019061185b9190613876565b50949350505050565b604051636553690d60e11b8152306004820152600090829082906001600160a01b0383169063caa6d21a9060240160206040518083038186803b1580156118aa57600080fd5b505afa1580156118be573d6000803e3d6000fd5b505050506040513d601f19601f820116820180604052508101906118e29190613876565b60405163d99d13f560e01b8152306004820152602481018290529091506000906001600160a01b0384169063d99d13f59060440160006040518083038186803b15801561192e57600080fd5b505afa158015611942573d6000803e3d6000fd5b505050506040513d6000823e601f3d908101601f1916820160405261196a9190810190613715565b8051519091506119a75760405162461bcd60e51b8152602060048201526008602482015267139bc81cda1bdc9d60c21b60448201526064016102e7565b600081604001516000815181106119ce57634e487b7160e01b600052603260045260246000fd5b6020026020010151905060006001600160a01b0316816001600160a01b031614156119ff5750600095945050505050565b6040516370a0823160e01b81523060048201526000906001600160a01b038316906370a082319060240160206040518083038186803b158015611a4157600080fd5b505afa158015611a55573d6000803e3d6000fd5b505050506040513d601f19601f82011682018060405250810190611a799190613876565b60408051600180825281830190925291925060009190816020015b611a9c613241565b815260200190600190039081611a94579050506040805161010081019091529091508060078152602001306001600160a01b03168152602001306001600160a01b0316815260200160006001600160a01b0316815260200186815260200160008152602001600081526020016040518060200160405280600081525081525081600081518110611b3c57634e487b7160e01b600052603260045260246000fd5b6020908102919091010152604051635b0bf86360e11b81526001600160a01b0387169063b617f0c690611b7390849060040161397a565b600060405180830381600087803b158015611b8d57600080fd5b505af1158015611ba1573d6000803e3d6000fd5b50506040516370a0823160e01b8152306004820152600092506001600160a01b03861691506370a082319060240160206040518083038186803b158015611be757600080fd5b505afa158015611bfb573d6000803e3d6000fd5b505050506040513d601f19601f82011682018060405250810190611c1f9190613876565b9050610666818461226a565b6001820154600090819081908190819081906020880135906001600160801b0380821691600160801b90041683611c668460608d013561226a565b9050611cbd818d600001600f9054906101000a90046001600160681b03166001600160681b03168e60010160009054906101000a90046001600160801b03166001600160801b03168e608001358f60a00135612691565b919750909550611ccf9050848661226a565b9350611cf8611ce260408d01358461226a565b611cf08660608f013561226a565b858e35612742565b9750611d18611d0d60c08d01358a8e35612778565b60608d013590612644565b9850611d2683898d356127da565b9650611d32848a61226a565b9950505050509295509295509295565b6040516370a0823160e01b8152306004820152600090849082906001600160a01b038616906370a082319060240160206040518083038186803b158015611d8857600080fd5b505afa158015611d9c573d6000803e3d6000fd5b505050506040513d601f19601f82011682018060405250810190611dc09190613876565b60405163565eea1960e01b81526001600160a01b038781166004830152602482018390529192509083169063565eea199060440160206040518083038186803b158015611e0c57600080fd5b505afa158015611e20573d6000803e3d6000fd5b505050506040513d601f19601f82011682018060405250810190611e449190613876565b611e5357600092505050610683565b6040516370a0823160e01b81523060048201526000906001600160a01b038616906370a082319060240160206040518083038186803b158015611e9557600080fd5b505afa158015611ea9573d6000803e3d6000fd5b505050506040513d601f19601f82011682018060405250810190611ecd9190613876565b60408051600180825281830190925291925060009190816020015b611ef0613241565b815260200190600190039081611ee857905050604080516101008101909152909150806008815260200160006001600160a01b03168152602001306001600160a01b03168152602001886001600160a01b0316815260200160008152602001848152602001600081526020016040518060200160405280600081525081525081600081518110611f9057634e487b7160e01b600052603260045260246000fd5b6020908102919091010152604051635b0bf86360e11b81526001600160a01b0385169063b617f0c690611fc790849060040161397a565b600060405180830381600087803b158015611fe157600080fd5b505af1158015611ff5573d6000803e3d6000fd5b50506040516370a0823160e01b8152306004820152600092506001600160a01b03891691506370a082319060240160206040518083038186803b158015611be757600080fd5b60008080808061205961205460608a0160408b016133be565b61283d565b9050600061206d60e08a0160c08b016133be565b885460018a0154895492935060ff8216926001600160a01b03918216926201000090049091169061ffff166120a860a08e0160808f01613854565b61ffff16146121355760405163e436b89160e01b81526004810186905283151560248201526001600160a01b0385169063e436b89190604401604080518083038186803b1580156120f857600080fd5b505afa15801561210c573d6000803e3d6000fd5b505050506040513d601f19601f82011682018060405250810190612130919061388e565b6121ab565b8b60a00135846001600160a01b03166312b495a86040518163ffffffff1660e01b815260040160206040518083038186803b15801561217357600080fd5b505afa158015612187573d6000803e3d6000fd5b505050506040513d601f19601f820116820180604052508101906121ab9190613876565b9097509550866121ec5760405162461bcd60e51b815260206004820152600c60248201526b21737472696b65507269636560a01b60448201526064016102e7565b6121fb8c8c84848b8a896128f1565b985061221f898d60e001602081019061221491906133be565b8e6101000135612388565b97506000881161225c5760405162461bcd60e51b8152602060048201526008602482015267217072656d69756d60c01b60448201526064016102e7565b505050505093509350935093565b6000610c718284613c1f565b604051636eb1769f60e11b81523060048201526001600160a01b038381166024830152600091839186169063dd62ed3e9060440160206040518083038186803b1580156122c257600080fd5b505afa1580156122d6573d6000803e3d6000fd5b505050506040513d601f19601f820116820180604052508101906122fa9190613876565b6123049190613ae9565b6040516001600160a01b03851660248201526044810182905290915061236a90859063095ea7b360e01b906064015b60408051601f198184030181529190526020810180516001600160e01b03166001600160e01b031990931692909217909152612a85565b50505050565b6000610c718284613b01565b6000610c718284613c00565b60008084905060008490506000816001600160a01b031663fc3d42e8846001600160a01b031663c52987cf6040518163ffffffff1660e01b815260040160206040518083038186803b1580156123dd57600080fd5b505afa1580156123f1573d6000803e3d6000fd5b505050506040513d601f19601f820116820180604052508101906124159190613876565b856001600160a01b031663ade6e2aa6040518163ffffffff1660e01b815260040160206040518083038186803b15801561244e57600080fd5b505afa158015612462573d6000803e3d6000fd5b505050506040513d601f19601f820116820180604052508101906124869190613876565b866001600160a01b031663f3c274a66040518163ffffffff1660e01b815260040160206040518083038186803b1580156124bf57600080fd5b505afa1580156124d3573d6000803e3d6000fd5b505050506040513d601f19601f820116820180604052508101906124f79190613683565b6040516001600160e01b031960e086901b168152600481019390935260248301919091521515604482015260640160206040518083038186803b15801561253d57600080fd5b505afa158015612551573d6000803e3d6000fd5b505050506040513d601f19601f820116820180604052508101906125759190613876565b9050612590612586600a6064613c00565b610936838861237c565b90506001600160601b038111156125f95760405162461bcd60e51b815260206004820152602760248201527f6f7074696f6e5072656d69756d203e20747970652875696e74393629206d61786044820152662076616c75652160c81b60648201526084016102e7565b6000811161263a5760405162461bcd60e51b815260206004820152600e60248201526d216f7074696f6e5072656d69756d60901b60448201526064016102e7565b9695505050505050565b6000610c718284613ae9565b6001600160a01b03831673dac17f958d2ee523a2206206994597c13d831ec714156126815761268183836000612b57565b61268c838383612b57565b505050565b6000806000808689116126a55760006126af565b6126af898861226a565b905060008060008a84111561273057600089116126cd5760006126f5565b6126f56126de620f42406064613c00565b6109368b61090e8f8961226a90919063ffffffff16565b925060008811612706576000612721565b612721612717620f42406064613c00565b610936868b61237c565b915061272d8383612644565b90505b919b909a509098509650505050505050565b60008061275083600a613b58565b905060008611612760578061263a565b61263a86610936612771888861226a565b849061237c565b6000600183116127c25760405162461bcd60e51b8152602060048201526015602482015274496e76616c6964206173736574506572536861726560581b60448201526064016102e7565b6106806127d083600a613b58565b610936868661237c565b6000600183116128245760405162461bcd60e51b8152602060048201526015602482015274496e76616c6964206173736574506572536861726560581b60448201526064016102e7565b6106808361093661283685600a613b58565b879061237c565b60006001600160a01b03821661285657610c7442612c7b565b6000826001600160a01b031663ade6e2aa6040518163ffffffff1660e01b815260040160206040518083038186803b15801561289157600080fd5b505afa1580156128a5573d6000803e3d6000fd5b505050506040513d601f19601f820116820180604052508101906128c99190613876565b90506128d88162093a80613ae9565b4211156128e85761068342612c7b565b61068381612c7b565b60008061290160208a018a6133be565b905060006001600160a01b03821663115470548961292560408e0160208f016133be565b8a8a8a8a6040518763ffffffff1660e01b815260040161294a96959493929190613941565b60206040518083038186803b15801561296257600080fd5b505afa158015612976573d6000803e3d6000fd5b505050506040513d601f19601f8201168201806040525081019061299a91906133da565b90506001600160a01b038116156129b4579150612a7a9050565b6000826001600160a01b031663c09746308a8d60200160208101906129d991906133be565b8b8b8b8b6040518763ffffffff1660e01b81526004016129fe96959493929190613941565b602060405180830381600087803b158015612a1857600080fd5b505af1158015612a2c573d6000803e3d6000fd5b505050506040513d601f19601f82011682018060405250810190612a5091906133da565b9050612a75818b8a8e6020016020810190612a6b91906133be565b8f60600135612d11565b925050505b979650505050505050565b6000612ada826040518060400160405280602081526020017f5361666545524332303a206c6f772d6c6576656c2063616c6c206661696c6564815250856001600160a01b03166131469092919063ffffffff16565b80519091501561268c5780806020019051810190612af89190613683565b61268c5760405162461bcd60e51b815260206004820152602a60248201527f5361666545524332303a204552433230206f7065726174696f6e20646964206e6044820152691bdd081cdd58d8d9595960b21b60648201526084016102e7565b801580612be05750604051636eb1769f60e11b81523060048201526001600160a01b03838116602483015284169063dd62ed3e9060440160206040518083038186803b158015612ba657600080fd5b505afa158015612bba573d6000803e3d6000fd5b505050506040513d601f19601f82011682018060405250810190612bde9190613876565b155b612c4b5760405162461bcd60e51b815260206004820152603660248201527f5361666545524332303a20617070726f76652066726f6d206e6f6e2d7a65726f60448201527520746f206e6f6e2d7a65726f20616c6c6f77616e636560501b60648201526084016102e7565b6040516001600160a01b03831660248201526044810182905261268c90849063095ea7b360e01b90606401612333565b6000806007612c8d6201518085613b01565b612c98906004613ae9565b612ca29190613c62565b905060006007612cb383600c613c1f565b612cbd9190613c62565b612cca9062015180613c00565b612cd49085613ae9565b90506000612ce56201518083613c62565b612cef9083613c1f565b612cfb90617080613ae9565b9050808510610bee57610d4362093a8082613ae9565b6001600160a01b038516612d585760405162461bcd60e51b815260206004820152600e60248201526d216f746f6b656e4164647265737360901b60448201526064016102e7565b8354604080516379e13a5360e11b81529051879260ff161515916001600160a01b0384169163f3c274a691600480820192602092909190829003018186803b158015612da357600080fd5b505afa158015612db7573d6000803e3d6000fd5b505050506040513d601f19601f82011682018060405250810190612ddb9190613683565b151514612e1a5760405162461bcd60e51b815260206004820152600d60248201526c0a8f2e0ca40dad2e6dac2e8c6d609b1b60448201526064016102e7565b600185015460408051631c56369f60e21b815290516001600160a01b0392831692841691637158da7c916004808301926020929190829003018186803b158015612e6357600080fd5b505afa158015612e77573d6000803e3d6000fd5b505050506040513d601f19601f82011682018060405250810190612e9b91906133da565b6001600160a01b031614612ee95760405162461bcd60e51b815260206004820152601560248201527415dc9bdb99c81d5b99195c9b1e5a5b99d05cdcd95d605a1b60448201526064016102e7565b836001600160a01b0316816001600160a01b031663aabaecd66040518163ffffffff1660e01b815260040160206040518083038186803b158015612f2c57600080fd5b505afa158015612f40573d6000803e3d6000fd5b505050506040513d601f19601f82011682018060405250810190612f6491906133da565b6001600160a01b031614612fb25760405162461bcd60e51b815260206004820152601560248201527415dc9bdb99c818dbdb1b185d195c985b105cdcd95d605a1b60448201526064016102e7565b826001600160a01b0316816001600160a01b03166317d69bc86040518163ffffffff1660e01b815260040160206040518083038186803b158015612ff557600080fd5b505afa158015613009573d6000803e3d6000fd5b505050506040513d601f19601f8201168201806040525081019061302d91906133da565b6001600160a01b0316146130795760405162461bcd60e51b8152602060048201526013602482015272737472696b65417373657420213d205553444360681b60448201526064016102e7565b60006130854284612644565b905080826001600160a01b031663ade6e2aa6040518163ffffffff1660e01b815260040160206040518083038186803b1580156130c157600080fd5b505afa1580156130d5573d6000803e3d6000fd5b505050506040513d601f19601f820116820180604052508101906130f99190613876565b101561313d5760405162461bcd60e51b8152602060048201526013602482015272457870697279206265666f72652064656c617960681b60448201526064016102e7565b50505050505050565b6060610680848460008585843b61319f5760405162461bcd60e51b815260206004820152601d60248201527f416464726573733a2063616c6c20746f206e6f6e2d636f6e747261637400000060448201526064016102e7565b600080866001600160a01b031685876040516131bb9190613925565b60006040518083038185875af1925050503d80600081146131f8576040519150601f19603f3d011682016040523d82523d6000602084013e6131fd565b606091505b5091509150612a7a82828660608315613217575081610683565b8251156132275782518084602001fd5b8160405162461bcd60e51b81526004016102e79190613a58565b604080516101008101909152806000815260200160006001600160a01b0316815260200160006001600160a01b0316815260200160006001600160a01b03168152602001600081526020016000815260200160008152602001606081525090565b600082601f8301126132b2578081fd5b815160206132c76132c283613ac5565b613a94565b80838252828201915082860187848660051b89010111156132e6578586fd5b855b8581101561330d5781516132fb81613cb8565b845292840192908401906001016132e8565b5090979650505050505050565b600082601f83011261332a578081fd5b8151602061333a6132c283613ac5565b80838252828201915082860187848660051b8901011115613359578586fd5b855b8581101561330d5781518452928401929084019060010161335b565b60008083601f840112613388578182fd5b50813567ffffffffffffffff81111561339f578182fd5b6020830191508360208285010111156133b757600080fd5b9250929050565b6000602082840312156133cf578081fd5b813561068381613cb8565b6000602082840312156133eb578081fd5b815161068381613cb8565b60008060408385031215613408578081fd5b823561341381613cb8565b9150602083013561342381613cb8565b809150509250929050565b600080600060608486031215613442578081fd5b833561344d81613cb8565b9250602084013561345d81613cb8565b9150604084013561346d81613cb8565b809150509250925092565b6000806000806080858703121561348d578081fd5b843561349881613cb8565b935060208501356134a881613cb8565b925060408501356134b881613cb8565b9396929550929360600135925050565b6000806000806000806000806000806101a08b8d0312156134e7578788fd5b6134f18b35613cb8565b8a35995060208b013561350381613cb8565b985060408b013561351381613cb8565b975060608b0135965060808b0135955060a08b013567ffffffffffffffff8082111561353d578687fd5b6135498e838f01613377565b909750955060c08d0135915080821115613561578485fd5b5061356e8d828e01613377565b90945092505060c08b8d0360df19011215613587578081fd5b60e08b0190509295989b9194979a5092959850565b6000806000606084860312156135b0578081fd5b83356135bb81613cb8565b925060208401356135cb81613cb8565b929592945050506040919091013590565b600080600080608085870312156135f1578182fd5b84356135fc81613cb8565b9350602085013561360c81613cb8565b93969395505050506040820135916060013590565b60008060408385031215613633578182fd5b823561363e81613cb8565b946020939093013593505050565b60008060008060808587031215613661578182fd5b843561366c81613cb8565b93506020850135925060408501356134b881613cb8565b600060208284031215613694578081fd5b81518015158114610683578182fd5b60008060008385036101608112156136b9578182fd5b610120808212156136c8578283fd5b9496948701359550505061014085013592915050565b6000808284036101008112156136f2578283fd5b8335925060e0601f1982011215613707578182fd5b506020830190509250929050565b600060208284031215613726578081fd5b815167ffffffffffffffff8082111561373d578283fd5b9083019060c08286031215613750578283fd5b613758613a6b565b825182811115613766578485fd5b613772878286016132a2565b825250602083015182811115613786578485fd5b613792878286016132a2565b6020830152506040830151828111156137a9578485fd5b6137b5878286016132a2565b6040830152506060830151828111156137cc578485fd5b6137d88782860161331a565b6060830152506080830151828111156137ef578485fd5b6137fb8782860161331a565b60808301525060a083015182811115613812578485fd5b61381e8782860161331a565b60a08301525095945050505050565b60006020828403121561383e578081fd5b81356001600160681b0381168114610683578182fd5b600060208284031215613865578081fd5b813561ffff81168114610683578182fd5b600060208284031215613887578081fd5b5051919050565b600080604083850312156138a0578182fd5b505080516020909101519092909150565b6000602082840312156138c2578081fd5b813566ffffffffffffff81168114610683578182fd5b6000602082840312156138e9578081fd5b815160ff81168114610683578182fd5b60008151808452613911816020860160208601613c36565b601f01601f19169290920160200192915050565b60008251613937818460208701613c36565b9190910192915050565b6001600160a01b03968716815294861660208601529290941660408401526060830152608082019290925290151560a082015260c00190565b60006020808301818452808551808352604092508286019150828160051b870101848801865b83811015613a4a57603f1989840301855281516101008151600b81106139d457634e487b7160e01b8b52602160045260248bfd5b8552818901516001600160a01b039081168a87015288830151811689870152606080840151909116908601526080808301519086015260a0808301519086015260c0808301519086015260e091820151918501819052613a36818601836138f9565b9689019694505050908601906001016139a0565b509098975050505050505050565b602081526000610c7160208301846138f9565b60405160c0810167ffffffffffffffff81118282101715613a8e57613a8e613ca2565b60405290565b604051601f8201601f1916810167ffffffffffffffff81118282101715613abd57613abd613ca2565b604052919050565b600067ffffffffffffffff821115613adf57613adf613ca2565b5060051b60200190565b60008219821115613afc57613afc613c76565b500190565b600082613b1057613b10613c8c565b500490565b600181815b80851115613b50578160001904821115613b3657613b36613c76565b80851615613b4357918102915b93841c9390800290613b1a565b509250929050565b6000610c718383600082613b6e57506001610c74565b81613b7b57506000610c74565b8160018114613b915760028114613b9b57613bb7565b6001915050610c74565b60ff841115613bac57613bac613c76565b50506001821b610c74565b5060208310610133831016604e8410600b8410161715613bda575081810a610c74565b613be48383613b15565b8060001904821115613bf857613bf8613c76565b029392505050565b6000816000190483118215151615613c1a57613c1a613c76565b500290565b600082821015613c3157613c31613c76565b500390565b60005b83811015613c51578181015183820152602001613c39565b8381111561236a5750506000910152565b600082613c7157613c71613c8c565b500690565b634e487b7160e01b600052601160045260246000fd5b634e487b7160e01b600052601260045260246000fd5b634e487b7160e01b600052604160045260246000fd5b6001600160a01b0381168114613ccd57600080fd5b5056fea2646970667358221220251f12ab01ae711787a1a23ea33afc1256c509ed5aacbf300cc497ceddf30f9864736f6c63430008040033",
  "devdoc": {
    "kind": "dev",
    "methods": {
      "allocateOptions(address,address,uint256,uint256)": {
        "details": "Skipped if the optionsPurchaseQueue doesn't exist",
        "params": {
          "option": "is the minted option",
          "optionAllocation": "is the maximum % of options to allocate towards the purchase queue (will only allocate  up to the amount that is on the queue)",
          "optionsAmount": "is the amount of options minted",
          "optionsPurchaseQueue": "is the OptionsPurchaseQueue contract"
        },
        "returns": {
          "allocatedOptions": "is the amount of options that ended up getting allocated to the OptionsPurchaseQueue"
        }
      },
      "burnOtokens(address,address)": {
        "params": {
          "currentOption": "is the address of the current option",
          "gammaController": "is the address of the opyn controller contract"
        },
        "returns": {
          "_0": "amount of collateral redeemed by burning otokens"
        }
      },
      "closeRound(Vault.VaultState storage,VaultLifecycleWithSwap.CloseParams)": {
        "params": {
          "params": "is the rollover parameters passed to compute the next state",
          "vaultState": "is the storage variable vaultState passed from RibbonVault"
        },
        "returns": {
          "mintShares": "is the amount of shares to mint from deposits",
          "newLockedAmount": "is the amount of funds to allocate for the new round",
          "newPricePerShare": "is the price per share of the new round",
          "performanceFeeInAsset": "is the performance fee charged by vault",
          "queuedWithdrawAmount": "is the amount of funds set aside for withdrawal",
          "totalVaultFee": "is the total amount of fee charged by vault"
        }
      },
      "commitNextOption(VaultLifecycleWithSwap.CommitParams,Vault.VaultParams storage,Vault.VaultState storage)": {
        "params": {
          "commitParams": "is the struct with details on previous option and strike selection details",
          "vaultParams": "is the struct with vault general data",
          "vaultState": "is the struct with vault accounting state"
        },
        "returns": {
          "delta": "is the delta of the new option",
          "otokenAddress": "is the address of the new option",
          "premium": "is the premium of the new option",
          "strikePrice": "is the strike price of the new option"
        }
      },
      "createOffer(address,uint256,address,Vault.VaultParams storage)": {
        "params": {
          "currOtokenPremium": "is premium for each otoken",
          "currentOtoken": "is the current otoken address",
          "swapContract": "the address of the swap contract",
          "vaultParams": "is the struct with vault general data"
        },
        "returns": {
          "optionAuctionID": "auction id of the newly created offer"
        }
      },
      "createShort(address,address,address,uint256)": {
        "params": {
          "depositAmount": "is the amount of collateral to deposit",
          "gammaController": "is the address of the opyn controller contract",
          "marginPool": "is the address of the opyn margin contract which holds the collateral",
          "oTokenAddress": "is the address of the otoken to mint"
        },
        "returns": {
          "_0": "the otoken mint amount"
        }
      },
      "getAuctionSettlementPrice(address,uint256)": {
        "params": {
          "optionAuctionID": "is the offer ID",
          "swapContract": "The address of the swap settlement contract"
        },
        "returns": {
          "_0": "settlementPrice Auction settlement price"
        }
      },
      "sellOptionsToQueue(address,address,uint256)": {
        "details": "Reverts if the auction hasn't settled yet",
        "params": {
          "optionsPurchaseQueue": "is the OptionsPurchaseQueue contract",
          "swapContract": "The address of the swap settlement contract"
        },
        "returns": {
          "_0": "totalPremiums Total premiums earnt by the vault"
        }
      },
      "settleLong(address,address,address)": {
        "params": {
          "asset": "is the address of the vault's asset",
          "gammaController": "is the address of the opyn controller contract",
          "oldOption": "is the address of the old option"
        },
        "returns": {
          "_0": "amount of asset received by exercising the option"
        }
      },
      "settleShort(address)": {
        "params": {
          "gammaController": "is the address of the opyn controller contract"
        },
        "returns": {
          "_0": "amount of collateral redeemed from the vault"
        }
      },
      "verifyInitializerParams(address,address,address,uint256,uint256,string,string,Vault.VaultParams)": {
        "params": {
          "_vaultParams": "is the struct with vault general data",
          "feeRecipient": "is the address to recieve vault performance and management fees",
          "owner": "is the owner of the vault with critical permissions",
          "performanceFee": "is the perfomance fee pct.",
          "tokenName": "is the name of the token",
          "tokenSymbol": "is the symbol of the token"
        }
      }
    },
    "version": 1
  },
  "userdoc": {
    "kind": "user",
    "methods": {
      "allocateOptions(address,address,uint256,uint256)": {
        "notice": "Allocates the vault's minted options to the OptionsPurchaseQueue contract"
      },
      "burnOtokens(address,address)": {
        "notice": "Burn the remaining oTokens left over from auction. Currently this implementation is simple. It burns oTokens from the most recent vault opened by the contract. This assumes that the contract will only have a single vault open at any given time."
      },
      "closeRound(Vault.VaultState storage,VaultLifecycleWithSwap.CloseParams)": {
        "notice": "Calculate the shares to mint, new price per share, and amount of funds to re-allocate as collateral for the new round"
      },
      "commitNextOption(VaultLifecycleWithSwap.CommitParams,Vault.VaultParams storage,Vault.VaultState storage)": {
        "notice": "Sets the next option the vault will be shorting, and calculates its premium for the auction"
      },
      "createOffer(address,uint256,address,Vault.VaultParams storage)": {
        "notice": "Creates an offer in the Swap Contract"
      },
      "createShort(address,address,address,uint256)": {
        "notice": "Creates the actual Opyn short position by depositing collateral and minting otokens"
      },
      "getAuctionSettlementPrice(address,uint256)": {
        "notice": "Gets the settlement price of a settled auction"
      },
      "sellOptionsToQueue(address,address,uint256)": {
        "notice": "Sell the allocated options to the purchase queue post auction settlement"
      },
      "settleLong(address,address,address)": {
        "notice": "Exercises the ITM option using existing long otoken position. Currently this implementation is simple. It calls the `Redeem` action to claim the payout."
      },
      "settleShort(address)": {
        "notice": "Close the existing short otoken position. Currently this implementation is simple. It closes the most recent vault opened by the contract. This assumes that the contract will only have a single vault open at any given time. Since calling `_closeShort` deletes vaults by calling SettleVault action, this assumption should hold."
      },
      "verifyInitializerParams(address,address,address,uint256,uint256,string,string,Vault.VaultParams)": {
        "notice": "Verify the constructor params satisfy requirements"
      }
    },
    "version": 1
  },
  "storageLayout": {
    "storage": [],
    "types": null
  }
}